head,head_label,relation,tail,tail_label,description
船舶电力系统,System,HAS_SAFETY_NOTE,《钢质内河船舶建造规范》,SafetyNote,船舶电力系统需遵循该规范
三线绝缘系统,System,BELONGS_TO,船舶电力系统,System,三线绝缘系统是船舶电力系统的一部分
船舶电站,System,BELONGS_TO,船舶电力系统,System,船舶电站是船舶电力系统的一部分
轴带发电机,Equipment,HAS_COMPONENT,减速齿轮装置,Component,轴带发电机通过减速齿轮装置传动
轴带发电机,Equipment,BELONGS_TO,PTO模式,System,轴带发电机可作为发电机运行
主推进器失效,FaultPhenomenon,CAUSED_BY,油品泄漏,FaultPhenomenon,主推进器失效可能导致油品泄漏
动力装置冗余配置,System,REPAIRED_BY,PTO模式,System,冗余配置通过PTI模式实现应急推进
定距桨轴带发电装置,Equipment,HAS_COMPONENT,减速齿轮装置,Component,调距桨系统装有减速齿轮装置
定距桨轴带发电装置,Equipment,HAS_COMPONENT,中间传动机构,Component,需要中间传动机构提高发电机转速
并联机组调频波动,FaultPhenomenon,CAUSED_BY,主机转速波动,FaultPhenomenon,主机转速波动导致并联调频波动
逆功率运行,FaultPhenomenon,CAUSED_BY,主机与副机工作特性差别,FaultCause,特性不一致可能导致逆功率
轴带发电机输出频率变化,FaultPhenomenon,CAUSED_BY,主机负荷变化,FaultCause,主机负荷变化影响输出频率
主机超负荷运行,FaultPhenomenon,CAUSED_BY,主机允许输出功率限制,Parameter,超过允许功率会导致超负荷
主机超负荷运行,FaultPhenomenon,REPAIRED_BY,切除轴带发电机,RepairMethod,超负荷时需要切除轴带发电机
切除轴带发电机,RepairMethod,RELATED_TO,换为系泊发电机供电,RepairMethod,切除后切换至系泊发电机
轴带发电机,Equipment,DIAGNOSED_BY,采用系泊发电机供电,DiagnosticMethod,机动航行时使用系泊发电机
轴带发电机,Equipment,DIAGNOSED_BY,切换为轴带发电机供电,DiagnosticMethod,定速航行时切换至轴带发电机
轴带发电机,Equipment,HAS_SAFETY_NOTE,短时间并联运行,SafetyNote,只允许短时并联运行
短时间并联运行,SafetyNote,RELATED_TO,确保电站安全,SafetyNote,短时并联是为了确保安全
定距桨轴带发电装置,Equipment,HAS_COMPONENT,转速补偿装置,Component,定距桨系统配备转速补偿装置
定距桨轴带发电装置,Equipment,HAS_COMPONENT,频率补偿装置,Component,定距桨系统配备频率补偿装置
晶闸管整流-逆变器型系统,System,HAS_COMPONENT,轴带发电机,Component,系统包含轴带发电机
晶闸管整流-逆变器型系统,System,HAS_COMPONENT,晶闸管整流器,Component,系统包含整流器
晶闸管整流-逆变器型系统,System,HAS_COMPONENT,直流平滑滤波电抗器,Component,系统包含滤波电抗器
晶闸管整流-逆变器型系统,System,HAS_COMPONENT,晶闸管逆变器,Component,系统包含逆变器
晶闸管整流-逆变器型系统,System,HAS_COMPONENT,交流电抗器,Component,系统包含交流电抗器
晶闸管整流-逆变器型系统,System,HAS_COMPONENT,调相机,Component,系统包含调相机
晶闸管整流-逆变器型系统,System,HAS_COMPONENT,自动调压器,Component,系统包含自动调压器
晶闸管整流-逆变器型系统,System,HAS_COMPONENT,励磁变换器,Component,系统包含励磁变换器
晶闸管整流-逆变器型系统,System,HAS_COMPONENT,控制器,Component,系统包含控制器
晶闸管整流-逆变器型系统,System,HAS_COMPONENT,励磁变压器,Component,系统包含励磁变压器
调相机,Component,HAS_PARAMETER,主机允许输出功率限制,Parameter,调相机运行受主机功率限制
轴带发电机,Equipment,HAS_COMPONENT,逆变器,Component,轴带发电机系统包含逆变器
轴带发电机,Equipment,HAS_PARAMETER,励磁电流,Parameter,轴带发电机具有励磁电流参数
轴带发电机,Equipment,HAS_PARAMETER,电枢电流,Parameter,轴带发电机具有电枢电流参数
轴带发电机,Equipment,HAS_PARAMETER,额定功率输出特性曲线,Parameter,轴带发电机具有额定功率输出特性曲线
轴带发电机,Equipment,HAS_FAULT,过载,FaultPhenomenon,轴带发电机可能发生过载故障
过载,FaultPhenomenon,CAUSED_BY,负载越过额定输出曲线,FaultCause,过载是由于负载超过额定输出特性曲线引起的
控制系统,System,HAS_COMPONENT,频率控制程序,Component,控制系统包含频率控制器
控制系统,System,HAS_COMPONENT,自动调压器AVR,Component,控制系统包含自动调压器AVR
控制系统,System,HAS_COMPONENT,频率变换器,Component,轴带发电机系统包含频率变换器
系统频率调节,System,DIAGNOSED_BY,频率控制程序,Component,系统频率通过频率控制器进行调节
系统负载有功功率平衡调节,System,DIAGNOSED_BY,频率控制程序,Component,有功功率平衡通过频率控制器调节励磁电流实现
系统负载无功功率平衡调节,System,DIAGNOSED_BY,自动调压器AVR,Component,无功功率平衡通过自动调压器AVR调节励磁电流实现
轴带发电机,Equipment,REPAIRED_BY,带电转换,RepairMethod,轴带发电机在主机转速60%~110%时可进行带电转换
轴带发电机,Equipment,REPAIRED_BY,失电转换,RepairMethod,轴带发电机在主机转速低于60%时采用失电转换
应急电源,System,HAS_COMPONENT,蓄电池,Equipment,应急电源包含蓄电池
蓄电池,Equipment,HAS_COMPONENT,酸性蓄电池,Equipment,蓄电池包括酸性蓄电池类型
蓄电池,Equipment,HAS_COMPONENT,碱性蓄电池,Equipment,蓄电池包括碱性蓄电池类型
酸性蓄电池,Equipment,HAS_COMPONENT,容器,Component,酸性蓄电池由容器、极板、隔板等组成
酸性蓄电池,Equipment,HAS_COMPONENT,极板,Component,酸性蓄电池包含极板组件
酸性蓄电池,Equipment,HAS_COMPONENT,隔板,Component,酸性蓄电池使用隔板隔离极板
酸性蓄电池,Equipment,HAS_COMPONENT,电解液,Component,酸性蓄电池包含电解液
酸性蓄电池,Equipment,HAS_PARAMETER,开路电压,Parameter,酸性蓄电池具有开路电压参数
酸性蓄电池,Equipment,HAS_PARAMETER,工作电压,Parameter,酸性蓄电池具有工作电压参数
酸性蓄电池,Equipment,HAS_PARAMETER,电池容量,Parameter,酸性蓄电池具有电池容量参数
酸性蓄电池,Equipment,HAS_PARAMETER,放电终止电压,Parameter,酸性蓄电池具有放电终止电压参数
酸性蓄电池,Equipment,HAS_PARAMETER,充电终期电压,Parameter,酸性蓄电池具有充电终期电压参数
碱性蓄电池,Equipment,HAS_PARAMETER,开路电压,Parameter,碱性蓄电池具有开路电压参数
碱性蓄电池,Equipment,HAS_PARAMETER,工作电压,Parameter,碱性蓄电池具有工作电压参数
碱性蓄电池,Equipment,HAS_PARAMETER,电池容量,Parameter,碱性蓄电池具有电池容量参数
船舶新能源,System,RELATED_TO,太阳能,System,船舶新能源包括太阳能
船舶新能源,System,RELATED_TO,核能,System,船舶新能源包括核能
船舶新能源,System,RELATED_TO,氢能,System,船舶新能源包括氢能
船舶新能源,System,RELATED_TO,液化天然气,System,船舶新能源包括液化天然气
船舶新能源,System,RELATED_TO,燃料电池,Equipment,燃料电池是船舶新能源的一种
酸性蓄电池,Equipment,HAS_COMPONENT,正极板,Component,酸性蓄电池包含正极板
酸性蓄电池,Equipment,HAS_COMPONENT,负极板,Component,酸性蓄电池包含负极板
酸性蓄电池,Equipment,HAS_FAULT,电动势降低,FaultPhenomenon,酸性蓄电池放电后出现电动势降低
酸性蓄电池,Equipment,HAS_FAULT,相对密度降低,FaultPhenomenon,酸性蓄电池放电时电解液相对密度降低
电动势降低,FaultPhenomenon,CAUSED_BY,放电,FaultCause,电动势降低由放电过程引起
相对密度降低,FaultPhenomenon,CAUSED_BY,放电,FaultCause,相对密度降低由放电化学反应生成水引起
电动势降低,FaultPhenomenon,DIAGNOSED_BY,比重计测量,DiagnosticMethod,通过比重计测量电解液相对密度估算电动势
酸性蓄电池,Equipment,REPAIRED_BY,充电,RepairMethod,酸性蓄电池通过充电恢复化学能
碱性蓄电池,Equipment,HAS_COMPONENT,氢氧化钾溶液,Component,碱性蓄电池以氢氧化钾溶液为电解液
碱性蓄电池,Equipment,HAS_FAULT,电压下降,FaultPhenomenon,碱性蓄电池放电时电压下降
电压下降,FaultPhenomenon,DIAGNOSED_BY,测量电压法,DiagnosticMethod,通过测量电压判断碱性蓄电池充放电状态
蓄电池,Equipment,HAS_PARAMETER,容量,Parameter,蓄电池具有容量参数
酸性蓄电池,Equipment,HAS_PARAMETER,标准放电电流,Parameter,酸性蓄电池以10h放电电流为标准
碱性蓄电池,Equipment,HAS_PARAMETER,标准放电电流,Parameter,碱性蓄电池以8h放电电流为标准
容量,Parameter,RELATED_TO,电解液温度,Parameter,蓄电池容量与电解液温度有关
容量,Parameter,RELATED_TO,放电电流,Parameter,容量受放电电流大小影响
蓄电池,Equipment,REPAIRED_BY,恒电流充电,RepairMethod,蓄电池可采用恒电流充电
蓄电池,Equipment,REPAIRED_BY,恒电压充电,RepairMethod,蓄电池可采用恒电压充电
酸性蓄电池,Equipment,REPAIRED_BY,初次充电,RepairMethod,新酸性蓄电池需进行初次充电
蓄电池,Equipment,REPAIRED_BY,正常充电,RepairMethod,已放电蓄电池通过正常充电恢复容量
蓄电池,Equipment,REPAIRED_BY,均衡充电,RepairMethod,为平衡电池差异每月进行均衡充电
交互充放电方式,System,HAS_FAULT,瞬时断电,FaultPhenomenon,交互充放电方式切换时可能产生瞬时断电
蓄电池寿命降低,FaultPhenomenon,CAUSED_BY,超过标准电流放电,FaultCause,超过标准电流放电会降低蓄电池寿命
额定容量,Parameter,RELATED_TO,放电终止电压,Parameter,额定容量定义中涉及终止电压
浮充方式,System,HAS_COMPONENT,蓄电池,Equipment,浮充方式中包含蓄电池作为其组成部分。
浮充方式,System,HAS_COMPONENT,充电装置,Equipment,浮充方式中包含充电装置作为其组成部分。
浮充方式,System,HAS_COMPONENT,负载,Equipment,浮充方式中包含负载作为其供电对象。
交互充放电方式和浮充方式组合,System,HAS_COMPONENT,转换开关,Component,组合充电方式中包含转换开关用于切换操作。
交互充放电方式和浮充方式组合,System,HAS_COMPONENT,快速充电装置,Equipment,组合充电方式的一种配置中包含快速充电装置。
交互充放电方式和浮充方式组合,System,HAS_COMPONENT,浮充充电装置,Equipment,组合充电方式的一种配置中包含浮充充电装置。
交互充放电方式和浮充方式组合,System,RELATED_TO,均衡充电,DiagnosticMethod,组合充电方式可对其中一组蓄电池进行均衡充电。
酸性蓄电池,Equipment,HAS_FAULT,极板硫化,FaultPhenomenon,酸性蓄电池在运行中可能发生极板硫化的故障现象。
极板硫化,FaultPhenomenon,CAUSED_BY,长时间充电不足,FaultCause,极板硫化可能由长时间充电不足引起。
极板硫化,FaultPhenomenon,CAUSED_BY,过放电,FaultCause,极板硫化可能由过放电引起。
极板硫化,FaultPhenomenon,REPAIRED_BY,过充电,RepairMethod,极板硫化可以通过过充电的方法进行修复。
酸性蓄电池,Equipment,DIAGNOSED_BY,检查液面高度,DiagnosticMethod,酸性蓄电池的维护包括每半个月检查电解液液面高度。
酸性蓄电池,Equipment,DIAGNOSED_BY,化验检查,DiagnosticMethod,酸性蓄电池的维护包括每年对电解液进行化验检查。
酸性蓄电池,Equipment,HAS_SAFETY_NOTE,蓄电池室应保持良好的通风，并严禁烟火,SafetyNote,酸性蓄电池使用和维护时有特定的安全注意事项。
碱性蓄电池,Equipment,HAS_FAULT,外壳带电,FaultPhenomenon,碱性蓄电池存在外壳带电的故障现象。
碱性蓄电池,Equipment,DIAGNOSED_BY,检查电压、电解液密度和高度,DiagnosticMethod,碱性蓄电池的维护包括每半个月检查电压、电解液密度和高度。
碱性蓄电池,Equipment,REPAIRED_BY,保持气塞透气或定期打开气塞放气,RepairMethod,碱性蓄电池的维护包括保持气塞透气或定期打开气塞放气。
碱性蓄电池,Equipment,REPAIRED_BY,更换电解液,RepairMethod,碱性蓄电池的维护包括每年或使用50~100次时更换电解液。
碱性蓄电池,Equipment,HAS_SAFETY_NOTE,存放时须防金属将负极与外壳接触，引起短路,SafetyNote,碱性蓄电池存放时有特定的安全注意事项。
配电装置,Equipment,HAS_COMPONENT,主配电板,Equipment,配电装置包括主配电板这一类型。
配电装置,Equipment,HAS_COMPONENT,应急配电板,Equipment,配电装置包括应急配电板这一类型。
配电装置,Equipment,HAS_COMPONENT,蓄电池充放电板,Equipment,配电装置包括蓄电池充放电板这一类型。
主配电板,Equipment,HAS_COMPONENT,并车屏,Component,主配电板由并车屏等部分组成。
主配电板,Equipment,HAS_COMPONENT,负载屏,Component,主配电板由负载屏等部分组成。
主配电板,Equipment,HAS_COMPONENT,汇流排,Component,主配电板由汇流排等部分组成。
汇流排,Component,HAS_PARAMETER,最大允许温升为45℃,Parameter,汇流排有一个重要的运行参数是其最大允许温升。
应急配电板,Equipment,BELONGS_TO,应急发电机,Equipment,应急配电板用于应急发电机的控制和监视。
应急配电板,Equipment,HAS_COMPONENT,供电联络开关,Component,应急配电板与主配电板之间通过供电联络开关连接。
充放电板,Equipment,HAS_COMPONENT,整流装置,Component,充放电板的电源部分主要由整流装置构成。
整流装置,Component,HAS_COMPONENT,晶闸管整流器,Component,现代船舶的整流装置常采用晶闸管整流器。
负序继电器,Equipment,HAS_COMPONENT,电子式负序继电器,Equipment,负序继电器的一种制造类型
电网绝缘监视仪,Equipment,DIAGNOSED_BY,声、光报警信号,DiagnosticMethod,当绝缘电阻过低时发出警报
绝缘电阻下降,FaultPhenomenon,CAUSED_BY,漏电电流增大,FaultCause,漏电电流增大会导致绝缘电阻下降
一相接地,FaultPhenomenon,CAUSED_BY,绝缘电阻下降,FaultPhenomenon,绝缘严重下降会导致一相接地
配电板式兆欧表,Equipment,HAS_COMPONENT,测量机构,Component,配电板式兆欧表的组成部分
配电板式兆欧表,Equipment,HAS_COMPONENT,附加装置,Component,配电板式兆欧表的组成部分
配电板式兆欧表,Equipment,DIAGNOSED_BY,表头指针偏转,DiagnosticMethod,通过指针偏转判断绝缘状况
船舶电力网,System,HAS_COMPONENT,主电网,System,船舶电网的一种分类
船舶电力网,System,HAS_COMPONENT,应急电网,System,船舶电网的一种分类
船舶电力网,System,HAS_COMPONENT,小应急电网,System,船舶电网的一种分类
船舶电力网,System,HAS_COMPONENT,放射式结线,Component,船舶电网的一种结线方式
船舶电力网,System,HAS_COMPONENT,环式结线,Component,船舶电网的一种结线方式
船舶电力网,System,HAS_COMPONENT,重要负载,Component,船舶电网中需要特别供电的设备
重要负载,Component,RELATED_TO,自动分级卸载装置,Component,该装置用于在过载时保护重要负载的供电
重要负载,Component,RELATED_TO,分段汇流排供电方式,Component,该供电方式用于提高重要负载的可靠性
船舶电力网,System,HAS_PARAMETER,绝缘电阻值,Parameter,电网需要监测的参数
绝缘电阻值,Parameter,RELATED_TO,1MΩ,Parameter,船舶电网要求绝缘电阻大于此值
小应急电网,System,HAS_PARAMETER,30min,Parameter,蓄电池需满足的供电时间要求
船舶电力网,System,HAS_SAFETY_NOTE,安全工作,SafetyNote,电网绝缘监测是安全工作的要求
电网绝缘监视仪,Equipment,HAS_SAFETY_NOTE,提高供电的安全性,SafetyNote,使用该设备的目的
船舶重要设备,Equipment,BELONGS_TO,船舶电力系统,System,船舶重要设备是船舶电力系统的一部分
船舶重要设备,Equipment,HAS_FAULT,主汇流排失电,FaultPhenomenon,当主电源故障时，重要设备可能面临主汇流排失电的故障
主汇流排失电,FaultPhenomenon,CAUSED_BY,主电源出现故障,FaultCause,主电源故障导致主汇流排失电
主汇流排失电,FaultPhenomenon,REPAIRED_BY,应急电源自动投入,RepairMethod,通过应急电源自动投入来应对主汇流排失电
应急电网,System,RELATED_TO,主电网,System,应急电网与主电网通过联络开关连接，在故障时切换
联络开关,Component,BELONGS_TO,船舶电力网,System,联络开关是船舶电网连接方式中的关键组件
船舶输电电缆,Component,HAS_COMPONENT,导电芯线,Component,导电芯线是电缆的组成部分
船舶输电电缆,Component,HAS_COMPONENT,电气绝缘层,Component,电气绝缘层是电缆的组成部分
船舶输电电缆,Component,HAS_COMPONENT,防护套,Component,防护套是电缆的组成部分
电气绝缘层,Component,HAS_PARAMETER,最高允许工作温度,Parameter,绝缘材料的性能由其最高允许工作温度决定
船舶电力系统的保护,System,HAS_PARAMETER,选择性,Parameter,选择性是保护装置的基本要求之一
船舶电力系统的保护,System,HAS_PARAMETER,速动性,Parameter,速动性是保护装置的基本要求之一
船舶电力系统的保护,System,HAS_PARAMETER,灵敏性,Parameter,灵敏性是保护装置的基本要求之一
船舶电力系统的保护,System,HAS_PARAMETER,可靠性,Parameter,可靠性是保护装置的基本要求之一
船舶电网的短路保护,System,DIAGNOSED_BY,时间原则,DiagnosticMethod,短路保护的选择性可通过时间原则整定
船舶电网的短路保护,System,DIAGNOSED_BY,电流原则,DiagnosticMethod,短路保护的选择性可通过电流原则整定
外部短路故障,FaultPhenomenon,REPAIRED_BY,万能式自动空气开关,Equipment,万能式自动空气开关可用于短路保护
外部短路故障,FaultPhenomenon,REPAIRED_BY,装置式自动空气开关,Equipment,装置式自动空气开关可用于短路保护
外部短路故障,FaultPhenomenon,REPAIRED_BY,熔断器,Component,熔断器常用作电网末级短路保护
舵机电动机,Equipment,HAS_SAFETY_NOTE,不设过载保护,SafetyNote,根据规范，舵机电动机不设过载保护，只设短路保护和过载报警
单相接地,FaultPhenomenon,DIAGNOSED_BY,绝缘指示灯,Equipment,绝缘指示灯可用于检测单相接地故障
单相接地,FaultPhenomenon,DIAGNOSED_BY,电网绝缘监视仪,Equipment,现代船舶使用绝缘监测仪实时监测单相接地等绝缘故障
同步发电机,Equipment,HAS_FAULT,外部短路,FaultPhenomenon,发电机可能发生外部短路故障
外部短路,FaultPhenomenon,REPAIRED_BY,外部短路保护,System,通过外部短路保护来应对发电机外部短路
外部短路保护,System,HAS_COMPONENT,短路短延时保护,System,短路短延时保护是外部短路保护的一种
外部短路保护,System,HAS_COMPONENT,短路瞬时保护,System,短路瞬时保护是外部短路保护的一种
同步发电机,Equipment,HAS_FAULT,过载,FaultPhenomenon,发电机可能发生过载故障
过载,FaultPhenomenon,REPAIRED_BY,过载保护,System,通过过载保护来应对发电机过载
同步发电机,Equipment,HAS_FAULT,欠压,FaultPhenomenon,发电机可能发生欠压故障
欠压,FaultPhenomenon,REPAIRED_BY,欠压保护,System,通过欠压保护来应对发电机欠压
同步发电机,Equipment,HAS_FAULT,逆功率运行,FaultPhenomenon,发电机可能发生逆功率故障
逆功率运行,FaultPhenomenon,REPAIRED_BY,逆功率保护,System,通过逆功率保护来应对发电机逆功率运行
船舶中压电力系统,System,HAS_COMPONENT,中压主电力系统,System,包含中压主系统
船舶中压电力系统,System,HAS_COMPONENT,低压辅助电力系统,System,包含低压辅助系统
船舶中压电力系统,System,HAS_COMPONENT,应急电力系统,System,包含应急系统
中压主电力系统,System,HAS_COMPONENT,主发电机组,Equipment,电源包括主发电机组
中压主电力系统,System,HAS_COMPONENT,吊舱式电力推进系统(SSP),Equipment,负载包括SSP
中压主电力系统,System,HAS_COMPONENT,侧推器,Equipment,负载包括侧推器
中压主电力系统,System,HAS_COMPONENT,旋转变流器,Equipment,负载包括旋转变流器
中压主电力系统,System,HAS_COMPONENT,中压开关柜控制室,Equipment,供配电装置包括中压开关柜控制室
吊舱式电力推进系统(SSP),Equipment,HAS_COMPONENT,永磁同步电动机,Component,包含永磁同步电动机
侧推器,Equipment,HAS_COMPONENT,侧推器电动机,Component,包含800kW电动机
低压辅助电力系统,System,HAS_COMPONENT,辅助发电机组,Equipment,电源包括辅助发电机组
低压辅助电力系统,System,HAS_COMPONENT,低压配电板控制室,Equipment,配电装置包括低压配电板控制室
应急电力系统,System,HAS_COMPONENT,应急发电机组,Equipment,电源包括应急发电机组
应急电力系统,System,HAS_COMPONENT,应急发电机控制室,Equipment,配电装置包括应急发电机控制室
中压主电力系统,System,HAS_FAULT,波形不好,FaultPhenomenon,可能出现波形不好的故障现象
低压辅助电力系统,System,HAS_FAULT,旋转变流机组发生故障或检修,FaultPhenomenon,可能出现旋转变流机组故障
波形不好,FaultPhenomenon,CAUSED_BY,大量变频调速负载,FaultCause,由大量变频调速负载引起
旋转变流机组发生故障或检修,FaultPhenomenon,DIAGNOSED_BY,断路器分合闸控制,DiagnosticMethod,通过断路器分合闸控制来诊断
断路器分合闸控制,DiagnosticMethod,REPAIRED_BY,人工操作PMA 71液晶显示单元的键盘,RepairMethod,通过人工操作键盘修复
断路器分合闸控制,DiagnosticMethod,REPAIRED_BY,使用鼠标或轨迹球输入命令,RepairMethod,通过输入命令修复
PMA 71电力自动管理系统,Equipment,HAS_COMPONENT,GENOP 71发电机保护/并车智能单元,Component,包含GENOP71单元
PMA 71电力自动管理系统,Equipment,HAS_COMPONENT,PLC单元,Component,包含PLC单元
中压断路器,Component,BELONGS_TO,中压开关柜控制室,Equipment,属于中压开关柜控制室
中压主电力系统,System,HAS_PARAMETER,6.6kV,Parameter,额定电压为6.6kV
低压辅助电力系统,System,HAS_PARAMETER,450V,Parameter,额定电压为450V
应急电力系统,System,HAS_PARAMETER,450V,Parameter,额定电压为450V
主发电机组,Equipment,HAS_PARAMETER,5200kVA,Parameter,额定容量为5200kVA
永磁同步电动机,Component,HAS_PARAMETER,4.7MW,Parameter,额定功率为4.7MW
侧推器电动机,Component,HAS_PARAMETER,800kW,Parameter,额定功率为800kW
中压断路器,Component,HAS_SAFETY_NOTE,带负载分合闸,SafetyNote,能带负载分合闸
中压断路器,Component,HAS_SAFETY_NOTE,灭弧装置,SafetyNote,带有灭弧装置
GENOP 71发电机保护/并车智能单元,Component,RELATED_TO,判断同步并车条件,DiagnosticMethod,用于判断同步并车条件
PLC单元,Component,RELATED_TO,同步并联指令,DiagnosticMethod,发出同步并联指令
中压主电力系统,System,HAS_COMPONENT,隔离开关,Component,系统包含隔离开关以保证安全
中压主电力系统,System,HAS_COMPONENT,接地开关,Component,系统包含接地开关以确保维修安全
中压主电力系统,System,HAS_COMPONENT,断路器,Component,系统使用断路器进行连接和保护
绝缘击穿,FaultPhenomenon,CAUSED_BY,电压足够高,FaultCause,绝缘击穿由电压过高引起
触电伤害,FaultPhenomenon,CAUSED_BY,距离带电部分过近,FaultCause,触电伤害由安全距离不足引起
过电压尖脉冲,FaultPhenomenon,CAUSED_BY,快速断开电感负荷,FaultCause,过电压尖脉冲由快速断开电感负荷引起
真空断路器,Component,HAS_FAULT,过电压尖脉冲,FaultPhenomenon,真空断路器可能引起过电压尖脉冲
过电压尖脉冲,FaultPhenomenon,REPAIRED_BY,安装过电压限制器,RepairMethod,通过安装过电压限制器来防止过电压尖脉冲
断路器意外合闸,FaultCause,REPAIRED_BY,合上接地开关,RepairMethod,维修时合上接地开关可防止断路器意外合闸导致事故
中压主电力系统,System,HAS_SAFETY_NOTE,安全操作规程,SafetyNote,系统中压设备操作需遵守安全规程
配电盘,Equipment,HAS_SAFETY_NOTE,耐电弧设计,SafetyNote,配电盘采用耐电弧设计以提高安全性
维修清洁,RepairMethod,DIAGNOSED_BY,停电维修,DiagnosticMethod,维修清洁时必须先停电
带电操作,DiagnosticMethod,DIAGNOSED_BY,使用合格的绝缘工具,DiagnosticMethod,带电操作需使用合格绝缘工具
保护方案,System,HAS_PARAMETER,选择性保护,Parameter,保护方案设计需考虑选择性
保护方案,System,HAS_PARAMETER,保护装置整定,Parameter,保护方案需进行保护装置整定研究
SF6断路器,Component,BELONGS_TO,中压主电力系统,System,SF6断路器属于中压电力系统常用组件
真空断路器,Component,BELONGS_TO,中压主电力系统,System,真空断路器属于中压电力系统常用组件
熔融接触器,Component,BELONGS_TO,中压主电力系统,System,熔融接触器可用于中压电力系统小功率场合
隔离开关,Component,RELATED_TO,断路器,Component,隔离开关与断路器有操作顺序和连锁关系
船舶电力系统,System,HAS_COMPONENT,继电保护,System,船舶电气系统包含继电保护系统
继电保护,System,HAS_COMPONENT,外部短路保护,Component,继电保护包括发电机外部短路保护
继电保护,System,HAS_COMPONENT,过载保护,Component,继电保护包括过载保护
继电保护,System,HAS_COMPONENT,欠压保护,Component,继电保护包括欠压保护
