head,head_label,relation,tail,tail_label,description
400V电力系统绝缘低故障,FaultPhenomenon,CAUSED_BY,厨房电器,Equipment,220V绝缘低故障常发生在厨房电器
400V电力系统绝缘低故障,FaultPhenomenon,CAUSED_BY,甲板照明系统,System,220V绝缘低故障常发生在甲板照明系统
同步发电机,Equipment,HAS_FAULT,运行参数失调故障,FaultPhenomenon,同步发电机可能发生运行参数失调故障
运行参数失调故障,FaultPhenomenon,HAS_COMPONENT,过电流,FaultPhenomenon,运行参数失调包括过电流
运行参数失调故障,FaultPhenomenon,HAS_COMPONENT,过载,FaultPhenomenon,运行参数失调包括过载
运行参数失调故障,FaultPhenomenon,HAS_COMPONENT,短路,FaultPhenomenon,运行参数失调包括短路
运行参数失调故障,FaultPhenomenon,HAS_COMPONENT,逆功率运行,FaultPhenomenon,运行参数失调包括逆功率
运行参数失调故障,FaultPhenomenon,HAS_COMPONENT,欠电压,FaultPhenomenon,运行参数失调包括欠电压
运行参数失调故障,FaultPhenomenon,HAS_COMPONENT,过电压,FaultPhenomenon,运行参数失调包括过电压
运行参数失调故障,FaultPhenomenon,HAS_COMPONENT,低频率,FaultPhenomenon,运行参数失调包括低频率
运行参数失调故障,FaultPhenomenon,HAS_COMPONENT,高频率,FaultPhenomenon,运行参数失调包括高频率
同步发电机,Equipment,HAS_PARAMETER,发电机额定电流,Parameter,同步发电机具有额定电流参数
断路器,Component,HAS_COMPONENT,过载保护,Component,断路器包含过载保护功能
断路器,Component,HAS_COMPONENT,外部短路保护,Component,断路器包含短路保护功能
过载保护,Component,HAS_COMPONENT,延时音响报警器,Component,过载保护包含延时音响报警器
断路器,Component,HAS_COMPONENT,短延时脱扣器,Component,断路器包含短延时脱扣器
主配电板,Equipment,HAS_COMPONENT,绝缘指示灯,Component,主配电板装有绝缘指示灯
MVC,Equipment,HAS_COMPONENT,可控硅整流桥,Component,MVC包含可控硅整流桥作为核心部件
MVC,Equipment,HAS_COMPONENT,比较放大器,Component,MVC包含比较放大器用于控制
MVC,Equipment,HAS_COMPONENT,手动电压调节电位器 R1,Component,MVC包含手动电压调节电位器用于设定电压
MVC,Equipment,RELATED_TO,发电机,Equipment,MVC用于调节发电机的输出电压
可控硅整流桥,Component,RELATED_TO,励磁机,Equipment,可控硅整流桥输出至励磁机励磁绕组
主配电板,Equipment,HAS_COMPONENT,发电机控制屏,Component,主配电板包含发电机控制屏
发电机控制屏,Component,HAS_COMPONENT,主开关,Component,发电机控制屏包含主开关
发电机控制屏,Component,HAS_COMPONENT,分级卸载保护装置,Component,发电机控制屏包含分级卸载保护装置
发电机控制屏,Component,HAS_COMPONENT,逆流继电器,Component,发电机控制屏包含逆流继电器
发电机控制屏,Component,HAS_COMPONENT,逆功率继电器,Component,发电机控制屏包含逆功率继电器
发电机控制屏,Component,HAS_COMPONENT,手动磁场变阻器,Component,发电机控制屏包含手动磁场变阻器
发电机控制屏,Component,HAS_COMPONENT,自动电压调整器,Component,发电机控制屏包含自动电压调整器
发电机控制屏,Component,HAS_COMPONENT,充磁按钮,Component,发电机控制屏包含充磁按钮
主配电板,Equipment,HAS_COMPONENT,粗同步电抗器,Component,主配电板包含粗同步电抗器
主配电板,Equipment,HAS_COMPONENT,同步表,Component,主配电板包含同步表
主配电板,Equipment,HAS_COMPONENT,同步指示灯,Component,主配电板包含同步指示灯
主配电板,Equipment,HAS_COMPONENT,岸电主开关,Component,主配电板包含岸电主开关
主配电板,Equipment,HAS_COMPONENT,逆序保护装置,Component,主配电板包含逆序保护装置
船舶配电装置,System,HAS_COMPONENT,空气断路器,Component,配电装置装有空气断路器
船舶配电装置,System,HAS_COMPONENT,装置式开关,Component,配电装置装装置式开关
船舶配电装置,System,HAS_COMPONENT,组合开关,Component,配电装置装有组合开关
船舶配电装置,System,HAS_COMPONENT,励磁变阻器,Component,配电装置装有励磁变阻器
发电机主开关（ACB）,Component,HAS_COMPONENT,失压脱扣装置,Component,主开关由失压脱扣装置组成
发电机主开关（ACB）,Component,HAS_COMPONENT,分励脱扣装置,Component,主开关由分励脱扣装置组成
发电机主开关（ACB）,Component,HAS_COMPONENT,过电流保护装置,Component,主开关由过电流保护装置组成
发电机主开关（ACB）,Component,HAS_COMPONENT,灭弧装置,Component,主开关由灭弧装置组成
发电机主开关（ACB）,Component,HAS_COMPONENT,辅助触头,Component,主开关由辅助触头组成
DW14型断路器,Component,HAS_COMPONENT,AOJ-1s过电流脱扣器,Component,DW14型断路器附加AOJ-1s过电流脱扣器
AOJ-1s过电流脱扣器,Component,HAS_COMPONENT,电流互感器（CT）,Component,过电流脱扣器使用电流互感器进行电流检测取样
发电机主开关不能合闸,FaultPhenomenon,CAUSED_BY,失压脱扣器不能正常吸合,FaultCause,主开关不能合闸可能由失压脱扣器故障引起
发电机主开关不能合闸,FaultPhenomenon,CAUSED_BY,脱扣机构磨损严重，钩不住,FaultCause,主开关不能合闸可能由脱扣机构磨损引起
发电机主开关不能合闸,FaultPhenomenon,CAUSED_BY,过电流（或电磁）脱扣器失调,FaultCause,主开关不能合闸可能由过电流脱扣器失调引起
发电机主开关不能合闸,FaultPhenomenon,CAUSED_BY,热脱扣器动作后未复位,FaultCause,主开关不能合闸可能由热脱扣器未复位引起
失压脱扣器不能正常吸合,FaultCause,DIAGNOSED_BY,检测失压线圈两端电压,DiagnosticMethod,诊断失压脱扣器故障的方法
失压脱扣器不能正常吸合,FaultCause,DIAGNOSED_BY,检查线圈是否开路,DiagnosticMethod,诊断失压脱扣器线圈故障的方法
脱扣机构磨损严重，钩不住,FaultCause,REPAIRED_BY,检查脱扣机械，调整相应螺栓或换新,RepairMethod,修复脱扣机构磨损的方法
过电流（或电磁）脱扣器失调,FaultCause,REPAIRED_BY,校正调整至要求值,RepairMethod,修复过电流脱扣器失调的方法
热脱扣器动作后未复位,FaultCause,REPAIRED_BY,停1~2s，待热元件复位,RepairMethod,使热脱扣器复位的方法
AOJ-1s过电流脱扣器,Component,HAS_PARAMETER,基准电流,Parameter,过电流脱扣器具有基准电流参数
AOJ-1s过电流脱扣器,Component,HAS_PARAMETER,CT变比,Parameter,过电流脱扣器具有CT变比参数
发电机,Equipment,HAS_FAULT,发电机主开关不能合闸,FaultPhenomenon,发电机可能出现主开关不能合闸的故障
发电机,Equipment,HAS_FAULT,主开关合闸后电网无电压,FaultPhenomenon,发电机可能出现主开关合闸后电网无电压的故障
岸电箱,Equipment,HAS_COMPONENT,岸电电源指示灯,Component,岸电箱上装有岸电电源指示灯
岸电箱,Equipment,HAS_COMPONENT,相序测定器,Equipment,岸电箱上装有相序测定器
岸电箱,Equipment,HAS_COMPONENT,负序继电器,Component,岸电箱可能装有负序继电器
相序不一致,FaultPhenomenon,CAUSED_BY,岸电与船电相序不匹配,FaultCause,相序不一致由岸电与船电相序不匹配引起
岸电箱的开关合上即跳闸,FaultPhenomenon,CAUSED_BY,相序不一致,FaultPhenomenon,开关跳闸由相序不一致引起
负序继电器,Component,DIAGNOSED_BY,相序测定器,Equipment,负序继电器通过相序测定器检测相序
换接岸电操作,RepairMethod,HAS_COMPONENT,主配电板,Equipment,换接岸电操作在主配电板前进行
换接岸电操作,RepairMethod,HAS_COMPONENT,岸电指示器,Component,换接岸电操作需观察岸电指示器
换接岸电操作,RepairMethod,HAS_SAFETY_NOTE,船舶发电机合闸供电,SafetyNote,换接岸电时严禁船舶发电机合闸供电
同步发电机并联运行,System,HAS_PARAMETER,相序一致,Parameter,并联运行需满足相序一致条件
同步发电机并联运行,System,HAS_PARAMETER,频率相等,Parameter,并联运行需满足频率相等条件
同步发电机并联运行,System,HAS_PARAMETER,相位相等,Parameter,并联运行需满足相位相等条件
同步发电机并联运行,System,HAS_PARAMETER,电压有效值相等,Parameter,并联运行需满足电压有效值相等条件
手动准同步法,DiagnosticMethod,DIAGNOSED_BY,整步表,Equipment,手动准同步法使用整步表指示相位差
手动准同步法,DiagnosticMethod,DIAGNOSED_BY,同步指示灯,Component,手动准同步法使用同步指示灯指示同步状态
半自动准同步法,DiagnosticMethod,REPAIRED_BY,自动同步装置,Equipment,半自动准同步法由自动同步装置完成合闸
自动准同步法,DiagnosticMethod,REPAIRED_BY,自动并车装置,Equipment,自动准同步法由自动并车装置自动合闸
粗同步法,DiagnosticMethod,HAS_COMPONENT,并车电抗器,Component,粗同步法使用并车电抗器减小冲击电流
有功功率调节与分配,RepairMethod,HAS_COMPONENT,手动调速开关,Component,有功功率调节通过手动调速开关实现
有功功率调节与分配,RepairMethod,DIAGNOSED_BY,功率表（有功）,Component,有功功率调节需观察功率表
自动调频调载装置,Equipment,REPAIRED_BY,有功功率调节与分配,RepairMethod,自动调频调载装置自动进行有功功率调节和分配
无功功率分配不均,FaultPhenomenon,DIAGNOSED_BY,电流表,Component,无功功率分配不均可通过电流表指示差异判断
船舶电站,System,HAS_SAFETY_NOTE,短暂的并联运行,SafetyNote,船舶电站中船电与岸电并联仅允许短暂运行
并联运行,System,BELONGS_TO,船舶电站,System,并联运行是船舶电站的一种运行状态
发电机,Equipment,HAS_COMPONENT,功率表（有功）,Component,发电机装有有功功率表
发电机,Equipment,HAS_COMPONENT,功率因数表（cosφ表）,Component,发电机装有功率因数表
发电机,Equipment,HAS_FAULT,无功功率分配不均,FaultPhenomenon,发电机并联运行时可能出现无功功率分配不均
无功功率分配不均,FaultPhenomenon,CAUSED_BY,均压线断路,FaultPhenomenon,均压线断路会导致无功功率分配不均
无功功率分配不均,FaultPhenomenon,DIAGNOSED_BY,检查均压线接触器是否通电动作,DiagnosticMethod,通过检查接触器状态诊断故障
无功功率分配不均,FaultPhenomenon,DIAGNOSED_BY,检查均压线接触器触点是否可靠闭合,DiagnosticMethod,通过检查触点状态诊断故障
均压线断路,FaultPhenomenon,REPAIRED_BY,修复或更新,RepairMethod,通过修复或更新部件解决断路
均压线断路,FaultPhenomenon,REPAIRED_BY,打磨修理,RepairMethod,通过打磨触点解决接触不良
并车失败,FaultPhenomenon,CAUSED_BY,冲击电流,FaultPhenomenon,冲击电流可能导致并车失败和跳闸
并车失败,FaultPhenomenon,CAUSED_BY,逆功率运行,FaultPhenomenon,逆功率运行会导致保护跳闸，并车失败
发电机,Equipment,HAS_COMPONENT,过载保护,Component,发电机配备过载保护装置
过载保护,Component,HAS_COMPONENT,优先脱扣,Component,过载保护包含优先脱扣功能
过载保护,Component,HAS_COMPONENT,自动分级卸载装置,Component,过载保护可通过自动分级卸载实现
发电机主开关,Component,HAS_COMPONENT,过电流脱扣器,Component,主开关内有过电流脱扣器
过电流脱扣器,Component,HAS_COMPONENT,短延时脱扣器,Component,过电流脱扣器包含长延时功能部件
船舶电站,System,HAS_COMPONENT,发电机,Equipment,船舶电站包含发电机
船舶电站,System,HAS_SAFETY_NOTE,避免在负载剧烈变化时并车,SafetyNote,电站操作的安全注意事项
船舶电站,System,HAS_SAFETY_NOTE,不能空载或轻载并车,SafetyNote,电站操作的安全注意事项
船舶电站,System,HAS_SAFETY_NOTE,并车后须及时转移负载,SafetyNote,电站操作的安全注意事项
船舶电站,System,HAS_SAFETY_NOTE,粗同步并车合闸时刻的选择,SafetyNote,粗同步并车的操作要求
发电机,Equipment,HAS_PARAMETER,额定电流,Parameter,发电机有额定电流参数
过载保护,Component,HAS_PARAMETER,长延时整定电流,Parameter,过载保护需要整定长延时电流值
优先脱扣,Component,HAS_PARAMETER,优先脱扣整定电流,Parameter,优先脱扣需要整定动作电流值
优先脱扣,Component,HAS_PARAMETER,延时时间,Parameter,优先脱扣需要整定延时时间
均压线,Component,BELONGS_TO,直流均压连接,Component,均压线是直流均压连接的组成部分
电流稳定装置,Component,BELONGS_TO,自动电压调整器,Component,电流稳定装置是调压器的一部分
自动电压调整器,Component,HAS_PARAMETER,调差系数,Parameter,电压调整器有调差系数参数
发电机,Equipment,HAS_FAULT,外部短路故障,FaultPhenomenon,发电机可能发生外部短路故障
外部短路故障,FaultPhenomenon,REPAIRED_BY,自动空气断路器,Equipment,外部短路故障由自动空气断路器保护动作
自动空气断路器,Equipment,HAS_COMPONENT,过电流脱扣器,Component,自动空气断路器包含过电流脱扣器
外部短路故障,FaultPhenomenon,DIAGNOSED_BY,AH主开关,Equipment,通过AH主开关进行短路保护试验
AH主开关,Equipment,HAS_COMPONENT,电子脱扣器,Component,AH主开关包含电子脱扣器
电子脱扣器,Component,HAS_PARAMETER,短路电流达2~2.5倍的额定电流,Parameter,电子脱扣器设定短延时动作电流值
电子脱扣器,Component,HAS_PARAMETER,延时0.2~0.6s,Parameter,电子脱扣器设定短延时动作时间
发电机,Equipment,HAS_FAULT,欠压保护,FaultPhenomenon,发电机需要欠压保护
欠压保护,FaultPhenomenon,REPAIRED_BY,自动空气断路器,Equipment,欠压保护由自动空气断路器实现
自动空气断路器,Equipment,HAS_COMPONENT,失压脱扣器,Component,自动空气断路器包含失压脱扣器
失压脱扣器,Component,HAS_PARAMETER,电压低于额定电压的70%~80%,Parameter,带延时欠压保护动作电压设定
失压脱扣器,Component,HAS_PARAMETER,延时1~3s,Parameter,带延时欠压保护动作时间设定
发电机,Equipment,HAS_FAULT,逆功率保护,FaultPhenomenon,发电机需要逆功率保护
逆功率保护,FaultPhenomenon,REPAIRED_BY,逆功率继电器,Component,逆功率保护由逆功率继电器实现
逆功率继电器,Component,HAS_PARAMETER,额定功率的8%~15%,Parameter,逆功率保护整定值
逆功率继电器,Component,HAS_PARAMETER,延时3~10s,Parameter,逆功率保护动作延时时间
主柴油发电机组自动控制系统,System,HAS_COMPONENT,M2000型柴油机控制器,Equipment,控制系统包含M2000控制器
M2000型柴油机控制器,Equipment,RELATED_TO,控制器,Equipment,M2000型柴油机控制器简称控制器
控制器,Equipment,HAS_COMPONENT,转换开关S1,Component,控制器连接工作方式选择开关
控制器,Equipment,HAS_COMPONENT,启动按钮S2,Component,控制器连接手动启动按钮
控制器,Equipment,HAS_COMPONENT,停机按钮S3,Component,控制器连接手动停机按钮
控制器,Equipment,HAS_COMPONENT,启动输出中间继电器K3,Component,控制器输出控制启动继电器
启动输出中间继电器K3,Component,RELATED_TO,启动电磁阀,Component,K3继电器控制启动电磁阀
控制器,Equipment,HAS_COMPONENT,速度传感器SG,Component,控制器接收速度传感器信号
速度传感器SG,Component,RELATED_TO,测速继电器B,Component,SG信号输入测速继电器B
测速继电器B,Component,HAS_PARAMETER,发火转速（33%）,Parameter,测速继电器判断发火转速的阈值
控制器,Equipment,HAS_COMPONENT,运行信号中间继电器K2,Component,控制器输出运行信号继电器
控制器,Equipment,HAS_COMPONENT,停机输出中间继电器K4,Component,控制器输出控制停机继电器
停机输出中间继电器K4,Component,RELATED_TO,停机电磁阀,Component,K4继电器控制停机电磁阀
控制器,Equipment,HAS_COMPONENT,预润滑控制定时电路,Component,控制器包含预润滑定时电路
预润滑控制定时电路,Component,HAS_PARAMETER,间歇30min、动作2min,Parameter,预润滑控制的时间参数
预润滑控制定时电路,Component,RELATED_TO,中间继电器 K6,Component,定时电路通过K5继电器输出
中间继电器 K6,Component,RELATED_TO,预供油泵控制箱,Equipment,K5继电器控制预供油泵控制箱
控制器,Equipment,HAS_FAULT,启动失败,FaultPhenomenon,控制器监测启动失败故障
控制器,Equipment,HAS_FAULT,超速,FaultPhenomenon,控制器监测超速故障
控制器,Equipment,HAS_FAULT,滑油低压,FaultPhenomenon,控制器监测滑油低压故障
控制器,Equipment,HAS_FAULT,冷却水高温,FaultPhenomenon,控制器监测冷却水高温故障
滑油低压,FaultPhenomenon,DIAGNOSED_BY,压力开关,Component,滑油低压由压力开关监测
冷却水高温,FaultPhenomenon,DIAGNOSED_BY,温度开关,Component,冷却水高温由温度开关监测
发电机外部短路保护,FaultPhenomenon,HAS_SAFETY_NOTE,《钢质海船入级规范》,SafetyNote,规范规定了外部短路保护要求
船舶发电机的欠压保护,FaultPhenomenon,HAS_SAFETY_NOTE,《钢质海船入级规范》,SafetyNote,规范规定了欠压保护要求
断线报警,FaultPhenomenon,DIAGNOSED_BY,检测电流回路,Component,通过检测电流回路监视线路是否完好
常开信号接点,Component,HAS_COMPONENT,3.3kΩ电阻,Component,常开信号接点两端并联3.3kΩ电阻
3.3kΩ电阻,Component,RELATED_TO,检测电流回路,Component,电阻构成检测电流回路
故障信号阻塞,DiagnosticMethod,RELATED_TO,滑油压力,Parameter,对滑油压力等参数在机器不运行和启动时进行阻塞
滑油压力,Parameter,CAUSED_BY,转速故障,FaultPhenomenon,滑油有压力但无机器运转信号导致转速故障
转速故障,FaultPhenomenon,DIAGNOSED_BY,超速显示条,Component,转速故障显示在超速显示条上
转换干触点输出,Component,RELATED_TO,中间继电器 K6,Component,常闭触点控制中间继电器K6
蓄电池,Component,HAS_COMPONENT,K1,Component,蓄电池供电由K1监视
电站自动控制系统,System,HAS_COMPONENT,GAC-5型发电机自动控制系统,Equipment,电站自动控制系统包含GAC-5型发电机自动控制系统
GAC-5型发电机自动控制系统,Equipment,HAS_COMPONENT,控制单元,Component,GAC-5系统包含控制单元
GAC-5型发电机自动控制系统,Equipment,HAS_COMPONENT,备机选择开关 S1,Component,GAC-5系统包含备机选择开关S1
手动、自动选择开关,Component,RELATED_TO,备用机组设置,System,手/自动选择开关影响备用机组的设置和后续
电网故障,FaultPhenomenon,HAS_SAFETY_NOTE,连续供电,SafetyNote,处理电网故障时应遵循连续供电原则
电网故障,FaultPhenomenon,HAS_PARAMETER,电压故障监测值,Parameter,电网故障处理依据电压故障监测值
电网故障,FaultPhenomenon,HAS_PARAMETER,频率故障监测值,Parameter,电网故障处理依据频率故障监测值
1级故障,FaultPhenomenon,REPAIRED_BY,启动备用机组,RepairMethod,发生1级故障时启动备用机组并投入并联运行
2级故障,FaultPhenomenon,REPAIRED_BY,启动备用机组,RepairMethod,发生2级故障时启动备用机组，故障机分闸
起励失败,FaultPhenomenon,REPAIRED_BY,启动后续备用机组,RepairMethod,起励失败时报警并启动后续备用机组
自动同步失败,FaultPhenomenon,REPAIRED_BY,启动后续备用机组,RepairMethod,自动同步失败时报警并启动后续备用机组
合闸失败,FaultPhenomenon,REPAIRED_BY,启动后续备用机组,RepairMethod,合闸失败时报警并启动后续备用机组
起励、合闸失败,FaultPhenomenon,RELATED_TO,起励失败,FaultPhenomenon,起励、合闸失败报警信号包含起励失败
起励、合闸失败,FaultPhenomenon,RELATED_TO,自动同步失败,FaultPhenomenon,起励、合闸失败报警信号包含自动同步失败
起励、合闸失败,FaultPhenomenon,RELATED_TO,合闸失败,FaultPhenomenon,起励、合闸失败报警信号包含合闸失败
运行状态发电机组故障,FaultPhenomenon,BELONGS_TO,发电机故障处理,System,运行状态发电机组故障属于发电机故障处理范畴
主配电板,Equipment,HAS_COMPONENT,ACB1,Component,主配电板包含供电开关ACB1
应急电力系统,System,HAS_COMPONENT,ACB2,Component,应急电力系统包含供电开关ACB2
ACB1,Component,HAS_COMPONENT,报警辅触头,Component,ACB1具有报警辅助触点
ACB1,Component,HAS_COMPONENT,失压线圈,Component,ACB1具有失压脱扣线圈
ACB2,Component,HAS_COMPONENT,失压线圈,Component,ACB2具有失压脱扣线圈
主电源失电,FaultPhenomenon,CAUSED_BY,K11释放,FaultCause,主电源失电由K11继电器释放导致
ACB2脱扣分断,FaultPhenomenon,CAUSED_BY,K11动作,FaultCause,K11动作输出断开ACB2失压线圈导致脱扣
ACB1合闸,System,CAUSED_BY,K12延时动作,FaultCause,K12延时动作输出使ACB1合闸
应急发电机停机,System,CAUSED_BY,K13延时动作,FaultCause,K13延时动作输出发出停机信号
供电自动转换功能,System,DIAGNOSED_BY,模拟失电,DiagnosticMethod,通过模拟失电检查自动转换功能
切断主配电板供电,RepairMethod,REPAIRED_BY,断开熔断器F1,RepairMethod,通过断开F1切断供电
取消供电自动转换功能,RepairMethod,REPAIRED_BY,控制开关置断开位,RepairMethod,通过设置控制开关取消功能
手动、自动选择开关,Component,RELATED_TO,S14,Component,选择开关具体为S14
S14,Component,CONTROLS,K34,Component,S14设定控制K34动作
K34,Component,CONTROLS,ACB1合闸按钮S11,Component,K34触点控制手动合闸允许
K34,Component,CONTROLS,ACB2合闸按钮S1,Component,K34触点控制手动合闸允许
正常、试验选择开关,Component,CONTROLS,K11线圈,Component,选择开关控制K11线圈通断
应急电力系统,System,HAS_PARAMETER,手动状态,Parameter,系统具有手动工作状态
应急电力系统,System,HAS_PARAMETER,自动状态,Parameter,系统具有自动工作状态
应急电力系统,System,HAS_PARAMETER,试验状态,Parameter,系统具有试验工作状态
机旁控制箱,Equipment,HAS_COMPONENT,控制开关,Component,控制箱上装有控制开关
控制电路,System,HAS_SAFETY_NOTE,始终处于自动工作状态,SafetyNote,控制电路默认自动工作需注意
仪用互感器,Equipment,HAS_COMPONENT,电压互感器,Equipment,仪用互感器包括电压互感器
仪用互感器,Equipment,HAS_COMPONENT,电流互感器,Equipment,仪用互感器包括电流互感器
电压互感器,Equipment,HAS_COMPONENT,原边绕组,Component,电压互感器包含原边绕组
电压互感器,Equipment,HAS_COMPONENT,副边绕组,Component,电压互感器包含副边绕组
电压互感器,Equipment,HAS_COMPONENT,外壳,Component,电压互感器有外壳
电压互感器,Equipment,HAS_FAULT,副边短路,FaultPhenomenon,电压互感器可能发生副边短路故障
副边短路,FaultPhenomenon,CAUSED_BY,绝缘损坏,FaultCause,副边短路可能由绝缘损坏引起
绝缘损坏,FaultCause,CAUSED_BY,高电压危险,FaultPhenomenon,绝缘损坏会导致高电压危险
电压互感器,Equipment,HAS_SAFETY_NOTE,接地,SafetyNote,电压互感器副边及外壳必须接地
电压互感器,Equipment,HAS_SAFETY_NOTE,副边不能短路,SafetyNote,电压互感器使用时副边不能短路
电压互感器,Equipment,HAS_SAFETY_NOTE,高压侧装接熔断器,SafetyNote,电压互感器高压侧需装熔断器
电压互感器,Equipment,HAS_PARAMETER,额定电压,Parameter,电压互感器有额定电压参数
电压互感器,Equipment,HAS_PARAMETER,副边电压,Parameter,电压互感器有副边电压参数
电流互感器,Equipment,HAS_COMPONENT,原边绕组,Component,电流互感器包含原边绕组
电流互感器,Equipment,HAS_COMPONENT,副边绕组,Component,电流互感器包含副边绕组
电流互感器,Equipment,HAS_COMPONENT,外壳,Component,电流互感器有外壳
电流互感器,Equipment,HAS_FAULT,副边开路,FaultPhenomenon,电流互感器可能发生副边开路故障
副边开路,FaultPhenomenon,CAUSED_BY,感应电势过高,FaultPhenomenon,副边开路会导致感应电势过高
感应电势过高,FaultPhenomenon,CAUSED_BY,绝缘击穿,FaultPhenomenon,感应电势过高可能引起绝缘击穿
副边开路,FaultPhenomenon,CAUSED_BY,铁芯发热,FaultPhenomenon,副边开路会导致铁芯发热
铁芯发热,FaultPhenomenon,CAUSED_BY,互感器烧毁,FaultPhenomenon,铁芯发热可能导致互感器烧毁
电流互感器,Equipment,HAS_SAFETY_NOTE,接地,SafetyNote,电流互感器副边及外壳必须接地
电流互感器,Equipment,HAS_SAFETY_NOTE,副边不能开路,SafetyNote,电流互感器使用时副边不能开路
电流互感器,Equipment,REPAIRED_BY,副边绕组短路,RepairMethod,拆装仪表时需先将副边绕组短路
电流互感器,Equipment,HAS_PARAMETER,原边额定电流,Parameter,电流互感器有原边额定电流参数
电流互感器,Equipment,HAS_PARAMETER,副边电流,Parameter,电流互感器有副边电流参数
钳形电流表,Equipment,RELATED_TO,电流互感器,Equipment,钳形电流表利用电流互感器原理
异步电动机,Equipment,HAS_COMPONENT,定子,Component,异步电动机包含定子
异步电动机,Equipment,HAS_COMPONENT,转子,Component,异步电动机包含转子
定子,Component,HAS_COMPONENT,定子铁芯,Component,定子包含定子铁芯
定子,Component,HAS_COMPONENT,定子绕组,Component,定子包含定子绕组
定子,Component,HAS_COMPONENT,机座,Component,定子包含机座
定子,Component,HAS_COMPONENT,端盖,Component,定子包含端盖
