head,head_label,relation,tail,tail_label,description
遮光盘,Component,HAS_PARAMETER,遮光盘开口角度,Parameter,遮光盘具有开口角度这一设计参数
遮光盘开口角度,Parameter,RELATED_TO,导通角,Parameter,遮光盘开口角度需略大于导通角以保证换相连续
鼠笼式三相异步电动机,Equipment,HAS_COMPONENT,转子,Component,鼠笼式电动机包含转子部件。
鼠笼式三相异步电动机,Equipment,HAS_COMPONENT,定子绕组,Component,鼠笼式电动机包含定子绕组部件。
鼠笼式三相异步电动机,Equipment,HAS_PARAMETER,起动电流 I_{ast},Parameter,鼠笼式电动机具有起动电流参数。
大容量鼠笼式电动机直接起动,FaultCause,CAUSED_BY,全电压直接起动,RepairMethod,采用全电压直接起动方法可能导致大电流问题。
船舶电网电压下降,FaultPhenomenon,CAUSED_BY,大容量鼠笼式电动机直接起动,FaultCause,大容量电动机直接起动是导致电网电压下降的原因。
影响其他用电设备正常工作,FaultPhenomenon,CAUSED_BY,船舶电网电压下降,FaultPhenomenon,电网电压下降是影响其他设备工作的原因。
《钢质海船入级规范》,System,RELATED_TO,全电压直接起动,RepairMethod,该规范用于限定和判断能否采用全电压直接起动。
双鼠笼式异步电动机,Equipment,HAS_COMPONENT,上笼,Component,双鼠笼式电动机的转子包含上笼组件。
双鼠笼式异步电动机,Equipment,HAS_COMPONENT,下笼,Component,双鼠笼式电动机的转子包含下笼组件。
双鼠笼式异步电动机,Equipment,HAS_PARAMETER,起动转矩大,Parameter,双鼠笼式电动机具有起动转矩大的参数特性。
双鼠笼式异步电动机,Equipment,HAS_PARAMETER,起动电流较小,Parameter,双鼠笼式电动机具有起动电流较小的参数特性。
深槽式异步电动机,Equipment,HAS_PARAMETER,起动转矩大,Parameter,深槽式电动机具有起动转矩大的参数特性。
深槽式异步电动机,Equipment,HAS_PARAMETER,起动电流较小,Parameter,深槽式电动机具有起动电流较小的参数特性。
双鼠笼式异步电动机,Equipment,REPAIRED_BY,全电压直接起动,RepairMethod,双鼠笼式电动机可以采用全电压直接起动（因其改善了性能）。
深槽式异步电动机,Equipment,REPAIRED_BY,全电压直接起动,RepairMethod,深槽式电动机可以采用全电压直接起动（因其改善了性能）。
起动转矩大,Parameter,CAUSED_BY,趋肤效应,FaultCause,起动时趋肤效应使转子呈现较大电阻，从而增大了起动转矩。
起动电流较小,Parameter,CAUSED_BY,趋肤效应,FaultCause,起动时趋肤效应限制了电流，使得起动电流较小。
降压起动,RepairMethod,CAUSED_BY,起动转矩减小,FaultPhenomenon,降压起动会导致起动转矩减小。
降压起动,RepairMethod,CAUSED_BY,起动时间较长,FaultPhenomenon,降压起动会导致起动时间延长。
降压起动,RepairMethod,HAS_SAFETY_NOTE,轻载起动,SafetyNote,降压起动方法一般用于轻载起动的场合。
星形-三角形（Y-Δ）换接降压起动,RepairMethod,BELONGS_TO,降压起动,RepairMethod,星三角起动是降压起动的一种具体方法。
自耦变压器降压起动,RepairMethod,BELONGS_TO,降压起动,RepairMethod,自耦变压器起动是降压起动的一种具体方法。
绕线式异步电动机,Equipment,HAS_COMPONENT,转子串电阻,Component,绕线式异步电动机采用转子串电阻的方法
转子串电阻,Component,HAS_PARAMETER,起动转矩大,Parameter,转子串电阻可以增大起动转矩
转子串电阻,Component,HAS_PARAMETER,起动电流,Parameter,转子串电阻可以减小起动电流
转子串电阻,Component,HAS_COMPONENT,继电接触器,Component,通过继电接触器逐级切除串接电阻
转子串电阻,Component,HAS_COMPONENT,频敏变阻器,Component,通过频敏变阻器等自动装置逐级切除串接电阻
异步电动机,Equipment,HAS_COMPONENT,电气制动,System,异步电动机具有电气制动系统
电气制动,System,HAS_COMPONENT,反接制动,System,反接制动是电气制动的一种
电气制动,System,HAS_COMPONENT,能耗制动,System,能耗制动是电气制动的一种
电气制动,System,HAS_COMPONENT,回馈制动,System,回馈制动是电气制动的一种
反接制动,System,HAS_COMPONENT,电源反接制动,System,电源反接制动是反接制动的一种
反接制动,System,HAS_COMPONENT,倒拉反接制动,System,倒拉反接制动是反接制动的一种
电源反接制动,System,HAS_FAULT,冲击电流,FaultPhenomenon,电源反接制动时会产生很大的冲击电流
冲击电流,FaultPhenomenon,REPAIRED_BY,转子回路中串入足够大的制动电阻,RepairMethod,为限制冲击电流，必须在转子回路中串入足够大的制动电阻
倒拉反接制动,System,REPAIRED_BY,增大转子回路电阻,RepairMethod,倒拉反接制动通常需要增大转子回路电阻才能实现
回馈制动,System,CAUSED_BY,转子转速高于定子旋转磁场的转速,FaultPhenomenon,当转子转速高于定子旋转磁场转速时，电动机会进入回馈制动状态
调速过程中出现的回馈制动,FaultPhenomenon,BELONGS_TO,回馈制动,System,调速过程中出现的回馈制动是回馈制动的一种情况
位能性负载作用下产生的回馈制动,FaultPhenomenon,BELONGS_TO,回馈制动,System,位能性负载作用下产生的回馈制动是回馈制动的一种情况
直流电动机,Equipment,HAS_FAULT,起动瞬间电枢电流过大,FaultPhenomenon,直流电动机起动瞬间，电枢电流会非常大
直流电动机,Equipment,HAS_COMPONENT,电枢电阻 R_{a},Component,直流电动机包含电枢电阻组件
直流电动机,Equipment,HAS_PARAMETER,起动电流 I_{ast},Parameter,直流电动机具有起动电流参数
直流电动机,Equipment,HAS_PARAMETER,额定电流 I_{aN},Parameter,直流电动机具有额定电流参数
直流电动机,Equipment,HAS_PARAMETER,起动转矩大,Parameter,直流电动机具有起动转矩参数
全电压直接起动,FaultPhenomenon,CAUSED_BY,电枢电阻 R_{a} 很小,Component,电枢电阻很小是导致全电压直接起动问题的原因之一
全电压直接起动,FaultPhenomenon,HAS_FAULT,起动电流过大,FaultPhenomenon,全电压直接起动会导致起动电流过大的故障现象
起动电流过大,FaultPhenomenon,CAUSED_BY,全电压直接起动,FaultPhenomenon,全电压直接起动是起动电流过大的直接原因
起动电流过大,FaultPhenomenon,HAS_FAULT,强烈的机械冲击,FaultPhenomenon,起动电流过大会导致强烈的机械冲击
强烈的机械冲击,FaultPhenomenon,CAUSED_BY,起动转矩大,Parameter,过大的起动转矩是引起强烈机械冲击的原因
起动电流过大,FaultPhenomenon,REPAIRED_BY,电枢回路串电阻分级起动,RepairMethod,电枢回路串电阻分级起动可用于修复起动电流过大的问题
起动电流过大,FaultPhenomenon,REPAIRED_BY,电枢降压起动,RepairMethod,电枢降压起动可用于修复起动电流过大的问题
电枢回路串电阻分级起动,RepairMethod,HAS_COMPONENT,起动电阻 R_{st},Component,电枢回路串电阻分级起动需要使用起动电阻组件
电枢回路串电阻分级起动,RepairMethod,RELATED_TO,二级起动,RepairMethod,二级起动是电枢回路串电阻分级起动的一种具体形式
电枢回路串电阻分级起动,RepairMethod,RELATED_TO,三级起动,RepairMethod,三级起动是电枢回路串电阻分级起动的一种具体形式
直流电动机,Equipment,HAS_COMPONENT,电枢回路,System,直流电动机包含电枢回路系统
直流电动机,Equipment,HAS_COMPONENT,励磁绕组回路,System,直流电动机包含励磁绕组回路系统
直流电动机,Equipment,HAS_PARAMETER,机械特性曲线,Parameter,直流电动机具有机械特性曲线参数
直流电动机,Equipment,HAS_PARAMETER,转速降 Δn,Parameter,直流电动机具有转速降参数
直流电动机,Equipment,HAS_PARAMETER,电枢电势 E_{a},Parameter,直流电动机具有电枢电势参数
直流电动机,Equipment,HAS_PARAMETER,主磁通 Φ,Parameter,直流电动机具有主磁通参数
直流电动机,Equipment,HAS_PARAMETER,电枢电流 I_{a},Parameter,直流电动机具有电枢电流参数
直流电动机,Equipment,HAS_PARAMETER,电磁转矩TM,Parameter,直流电动机具有电磁转矩参数
反接制动,RepairMethod,RELATED_TO,电源反接制动,RepairMethod,电源反接制动是反接制动的一种类型
反接制动,RepairMethod,RELATED_TO,倒拉反接制动,RepairMethod,倒拉反接制动是反接制动的一种类型
倒拉反接制动,RepairMethod,HAS_COMPONENT,位能性负载 T_{L},Component,倒拉反接制动通常用于位能性负载
电枢回路串电阻分级起动,RepairMethod,HAS_FAULT,电枢冲击电流,FaultPhenomenon,起动电阻切除过程中可能引起电枢冲击电流
电枢回路串电阻调速,RepairMethod,HAS_PARAMETER,特性曲线“硬度”,Parameter,电枢回路串电阻调速会影响特性曲线的硬度
改变电枢电压的调速,RepairMethod,HAS_PARAMETER,平滑的无级调速,Parameter,改变电枢电压的调速可以实现平滑的无级调速
改变电枢电压的调速,RepairMethod,HAS_COMPONENT,G-M系统,Equipment,改变电枢电压的调速可以使用G-M系统实现
改变电枢电压的调速,RepairMethod,HAS_COMPONENT,SCR-M系统,Equipment,改变电枢电压的调速可以使用SCR-M系统实现
减弱磁通 Φ 的调速,RepairMethod,HAS_PARAMETER,理想空载转速 n_{0},Parameter,减弱磁通调速会提高理想空载转速
减弱磁通 Φ 的调速,RepairMethod,HAS_PARAMETER,转速降 Δn,Parameter,减弱磁通调速会增加转速降
直流起货机,Equipment,DIAGNOSED_BY,弱磁调速,DiagnosticMethod,空钩运行时采用弱磁调速获得高速
弱磁调速,DiagnosticMethod,HAS_FAULT,机械特性变“软”,FaultPhenomenon,弱磁调速导致机械特性稳定性变差
弱磁调速,DiagnosticMethod,HAS_FAULT,动态电流大于额定电流,FaultPhenomenon,弱磁调速时动态电流异常增大
弱磁调速,DiagnosticMethod,CAUSED_BY,换向器限制,FaultCause,换向器性能限制转速调节范围
弱磁调速,DiagnosticMethod,CAUSED_BY,机械强度限制,FaultCause,机械强度限制转速调节范围
普通电动机,Equipment,DIAGNOSED_BY,弱磁调速,DiagnosticMethod,普通电动机采用弱磁调速方法
弱磁调速,DiagnosticMethod,RELATED_TO,降压调速,DiagnosticMethod,弱磁调速与降压调速配合使用扩大范围
直流起货机,Equipment,DIAGNOSED_BY,电枢串电阻调速,DiagnosticMethod,重载低速时采用电枢串电阻调速
电力拖动系统,System,HAS_COMPONENT,电动机,Equipment,系统以电动机作为原动机
电力拖动系统,System,HAS_COMPONENT,生产机械,Equipment,系统以生产机械作为负载
生产机械,Equipment,HAS_PARAMETER,负载转矩特性,Parameter,生产机械具有负载转矩特性
电动机,Equipment,HAS_PARAMETER,机械特性,Parameter,电动机具有机械特性
电力拖动系统,System,HAS_PARAMETER,工作点,Parameter,系统运行存在工作点
电力拖动系统,System,HAS_PARAMETER,运动方程式,Parameter,系统遵循运动方程式
电动机,Equipment,HAS_PARAMETER,起动转矩大,Parameter,电动机具有起动转矩参数
电动机,Equipment,HAS_PARAMETER,起动电流,Parameter,电动机具有起动电流参数
直流电动机,Equipment,REPAIRED_BY,电枢回路串电阻分级起动,RepairMethod,直流电动机采用分级起动方法
鼠笼式交流异步电动机,Equipment,HAS_COMPONENT,双鼠笼式转子,Component,可采用双鼠笼式转子结构
鼠笼式交流异步电动机,Equipment,HAS_COMPONENT,深槽式转子,Component,可采用深槽式转子结构
双鼠笼式转子,Component,CAUSED_BY,趋肤效应,FaultCause,利用趋肤效应改善起动性能
深槽式转子,Component,CAUSED_BY,趋肤效应,FaultCause,利用趋肤效应改善起动性能
鼠笼式异步电动机,Equipment,REPAIRED_BY,Y-△换接降压起动,RepairMethod,可采用星三角降压起动
鼠笼式异步电动机,Equipment,REPAIRED_BY,自耦变压器降压起动,RepairMethod,可采用自耦变压器降压起动
电动机,Equipment,DIAGNOSED_BY,电气制动,DiagnosticMethod,电动机可采用电气制动方式
异步电动机,Equipment,DIAGNOSED_BY,变频调速,DiagnosticMethod,异步电动机可采用变频调速
可编程逻辑控制器（PLC）,Equipment,BELONGS_TO,电器控制系统,System,PLC属于电器控制系统
接触器,Component,BELONGS_TO,控制电器,Component,接触器属于控制电器类别
继电器,Component,BELONGS_TO,控制电器,Component,继电器属于控制电器类别
熔断器,Component,BELONGS_TO,保护电器,Component,熔断器属于保护电器类别
主令电器,Component,BELONGS_TO,主令电器,Component,自分类关系
电磁制动器,Component,BELONGS_TO,执行电器,Component,电磁制动器属于执行电器
控制电器,Component,BELONGS_TO,船舶电器,Component,控制电器属于船舶电器分类
保护电器,Component,BELONGS_TO,船舶电器,Component,保护电器属于船舶电器分类
执行电器,Component,BELONGS_TO,船舶电器,Component,执行电器属于船舶电器分类
电磁式电器,Component,BELONGS_TO,船舶电器,Component,按工作原理分类的电器
非电量控制电器,Component,BELONGS_TO,船舶电器,Component,按工作原理分类的电器
接触器,Component,HAS_COMPONENT,触头系统,Component,接触器包含触头系统
触头系统,Component,HAS_COMPONENT,主触头,Component,触头系统包含主触头
触头系统,Component,HAS_COMPONENT,辅助触头,Component,触头系统包含辅助触头
触头系统,Component,HAS_COMPONENT,触头弹簧,Component,触头系统包含触头弹簧
接触器,Component,HAS_COMPONENT,灭弧装置,Component,接触器包含灭弧装置
辅助触头,Component,HAS_COMPONENT,常开触头,Component,辅助触头包括常开类型
辅助触头,Component,HAS_COMPONENT,常闭触头,Component,辅助触头包括常闭类型
交流接触器,Component,HAS_COMPONENT,双断点桥式触头,Component,交流接触器采用此触头结构
直流接触器,Component,HAS_COMPONENT,单断点指式结构,Component,直流接触器采用此触头结构
转换开关,Equipment,HAS_COMPONENT,自复位式转换开关,Component,转换开关包含自复位式操作方式
转换开关,Equipment,HAS_COMPONENT,定位式转换开关,Component,转换开关包含定位式操作方式
行程开关,Equipment,HAS_COMPONENT,按钮式行程开关,Component,行程开关的一种常用形式
行程开关,Equipment,HAS_COMPONENT,转臂式行程开关,Component,行程开关的一种常用形式
熔断器,Equipment,HAS_COMPONENT,管式熔断器,Component,船上常用的熔断器形式之一
熔断器,Equipment,HAS_COMPONENT,螺旋式熔断器,Component,船上常用的熔断器形式之一
熔断器,Equipment,HAS_COMPONENT,熔体,Component,熔断器的核心部件
熔断器,Equipment,HAS_FAULT,熔断,FaultPhenomenon,熔断器可能发生的故障现象
熔断,FaultPhenomenon,CAUSED_BY,短路,FaultCause,短路是导致熔断的原因之一
熔断,FaultPhenomenon,CAUSED_BY,严重过载,FaultCause,严重过载是导致熔断的原因之一
熔断器,Equipment,HAS_PARAMETER,保护特性,Parameter,熔断器的重要性能参数
熔断器,Equipment,HAS_PARAMETER,熔体额定电流,Parameter,熔断器选型的关键参数
熔体额定电流,Parameter,RELATED_TO,电动机额定电流,Parameter,熔体额定电流需根据电动机额定电流计算选择
继电器,Equipment,HAS_COMPONENT,电磁式继电器,Component,继电器的一种主要类型
电磁式继电器,Component,HAS_COMPONENT,过电流继电器,Component,电磁式继电器的一种应用形式
电磁式继电器,Component,HAS_COMPONENT,欠电压继电器,Component,电磁式继电器的一种应用形式
电磁式继电器,Component,HAS_PARAMETER,返回系数,Parameter,电磁式继电器的重要性能参数
继电器,Equipment,HAS_COMPONENT,时间继电器,Equipment,继电器的一种主要类型
时间继电器,Equipment,HAS_COMPONENT,半导体时间继电器,Component,时间继电器的一种类型
时间继电器,Equipment,HAS_COMPONENT,空气阻尼式时间继电器,Component,时间继电器的一种类型
继电器,Equipment,HAS_COMPONENT,热继电器FR,Equipment,继电器的一种主要类型
热继电器FR,Equipment,HAS_COMPONENT,双金属片,Component,热继电器包含双金属片
热继电器FR,Equipment,HAS_COMPONENT,发热元件,Component,热继电器包含发热元件
热继电器FR,Equipment,HAS_COMPONENT,杠杆,Component,热继电器包含杠杆
热继电器FR,Equipment,HAS_COMPONENT,触头,Component,热继电器包含触头
热继电器FR,Equipment,HAS_COMPONENT,弹簧,Component,热继电器包含弹簧
热继电器FR,Equipment,HAS_PARAMETER,热继电器额定电流,Parameter,热继电器有额定电流参数
热继电器FR,Equipment,HAS_PARAMETER,热元件额定电流,Parameter,热继电器有热元件额定电流参数
热继电器FR,Equipment,HAS_PARAMETER,整定电流,Parameter,热继电器有整定电流参数
热继电器FR,Equipment,HAS_PARAMETER,调节范围,Parameter,热继电器有调节范围参数
电动机过载,FaultPhenomenon,CAUSED_BY,过载电流,FaultCause,电动机过载由过载电流引起
过载电流,FaultCause,CAUSED_BY,热继电器脱扣,FaultPhenomenon,过载电流导致热继电器脱扣
速度继电器,Equipment,HAS_COMPONENT,转轴,Component,速度继电器包含转轴
速度继电器,Equipment,HAS_COMPONENT,永久磁铁,Component,速度继电器包含永久磁铁
速度继电器,Equipment,HAS_COMPONENT,笼式绕组,Component,速度继电器包含笼式绕组
速度继电器,Equipment,HAS_COMPONENT,胶木锤,Component,速度继电器包含胶木锤
电磁制动器,Equipment,HAS_COMPONENT,圆盘式电磁制动器,Equipment,电磁制动器包含圆盘式类型
电磁制动器,Equipment,HAS_COMPONENT,抱闸式电磁制动器,Equipment,电磁制动器包含抱闸式类型
圆盘式电磁制动器,Equipment,HAS_COMPONENT,电磁刹车线圈,Component,圆盘式制动器包含电磁刹车线圈
圆盘式电磁制动器,Equipment,HAS_COMPONENT,静摩擦片,Component,圆盘式制动器包含静摩擦片
圆盘式电磁制动器,Equipment,HAS_COMPONENT,动摩擦片,Component,圆盘式制动器包含动摩擦片
圆盘式电磁制动器,Equipment,HAS_COMPONENT,反作用弹簧,Component,圆盘式制动器包含反作用弹簧
圆盘式电磁制动器,Equipment,HAS_SAFETY_NOTE,螺栓调整均匀,SafetyNote,圆盘式制动器需均匀调整螺栓
圆盘式电磁制动器,Equipment,HAS_SAFETY_NOTE,间隙2~6mm,SafetyNote,圆盘式制动器间隙应为2~6mm
摩擦片歪斜,FaultPhenomenon,CAUSED_BY,螺栓调整不均匀,FaultCause,螺栓调整不均导致摩擦片歪斜
气隙不均匀,FaultPhenomenon,CAUSED_BY,螺栓调整不均匀,FaultCause,螺栓调整不均导致气隙不均匀
噪声大,FaultPhenomenon,CAUSED_BY,摩擦片歪斜,FaultPhenomenon,摩擦片歪斜导致噪声大
振动大,FaultPhenomenon,CAUSED_BY,气隙不均匀,FaultPhenomenon,气隙不均匀导致振动大
静、动摩擦片擦碰,FaultPhenomenon,CAUSED_BY,间隙过小,FaultCause,间隙过小导致摩擦片擦碰
较大机械碰撞,FaultPhenomenon,CAUSED_BY,间隙过大,FaultCause,间隙过大导致机械碰撞
抱闸式电磁制动器,Equipment,HAS_COMPONENT,制动电磁铁,Component,抱闸式制动器包含制动电磁铁
抱闸式电磁制动器,Equipment,HAS_COMPONENT,制动闸瓦,Component,抱闸式制动器包含制动闸瓦
电动机,Equipment,BELONGS_TO,短路电流保护,System,电动机需要短路电流保护
电动机,Equipment,BELONGS_TO,过载保护,System,电动机需要过载保护
电动机,Equipment,BELONGS_TO,欠电压保护,System,电动机需要欠电压保护
电动机,Equipment,BELONGS_TO,零电压保护,System,电动机需要零电压保护
电动机,Equipment,BELONGS_TO,缺相保护,System,三相电动机需要缺相保护
短路电流保护,System,DIAGNOSED_BY,熔断器,Equipment,短路保护由熔断器实现
过载保护,System,DIAGNOSED_BY,热继电器FR,Equipment,过载保护由热继电器实现
过载保护,System,DIAGNOSED_BY,过电流继电器,Equipment,过电流保护由过电流继电器实现
零电压保护,System,DIAGNOSED_BY,接触器 KM_{1},Equipment,零压保护可由接触器实现
欠电压保护,System,DIAGNOSED_BY,接触器 KM_{1},Equipment,欠压保护可由接触器实现
零电压保护,System,DIAGNOSED_BY,电压继电器,Equipment,零压保护可由电压继电器实现
欠电压保护,System,DIAGNOSED_BY,电压继电器,Equipment,欠压保护可由电压继电器实现
过电流继电器,Equipment,HAS_PARAMETER,动作电流值,Parameter,过电流继电器有动作电流值参数
零电压和欠电压保护的继电器或接触器,Equipment,HAS_PARAMETER,高返回系数,Parameter,该设备必须具备高返回系数
零电压和欠电压保护的继电器或接触器,Equipment,HAS_PARAMETER,吸引线圈的吸合电压 U_{x},Parameter,该设备的吸合电压参数
零电压和欠电压保护的继电器或接触器,Equipment,HAS_PARAMETER,释放电压 U_{\mathrm {f}},Parameter,该设备的释放电压参数
三相交流异步电动机,Equipment,HAS_FAULT,单相运行,FaultPhenomenon,电动机可能发生单相运行故障
单相运行,FaultPhenomenon,CAUSED_BY,任意一相断线（或失电）,FaultCause,单相运行由任意一相断线或失电引起
单相运行,FaultPhenomenon,CAUSED_BY,定子电流大大超过额定电流,FaultPhenomenon,单相运行导致定子电流异常增大
定子电流大大超过额定电流,FaultPhenomenon,CAUSED_BY,电机发热烧坏,FaultPhenomenon,过电流导致电机发热烧坏
单相运行,FaultPhenomenon,CAUSED_BY,剧烈的电振动和机械振动,FaultPhenomenon,单相运行伴随剧烈振动
缺相保护,System,DIAGNOSED_BY,热继电器FR,Component,缺相保护通过热继电器检测
缺相保护,System,REPAIRED_BY,断开接触器电源,RepairMethod,缺相保护通过断开接触器电源实现
点动控制,System,HAS_COMPONENT,按钮 SB_{1},Component,点动控制系统包含起动按钮
点动控制,System,HAS_COMPONENT,接触器 KM_{1},Component,点动控制系统包含接触器
连续控制,System,HAS_COMPONENT,自锁触头,Component,连续控制系统包含自锁触头
连续控制,System,HAS_COMPONENT,停车按钮 SB_{2},Component,连续控制系统包含停车按钮
行程控制,System,HAS_COMPONENT,行程开关,Component,行程控制系统包含行程开关
多地点控制,System,RELATED_TO,机舱泵电动机,Equipment,多地点控制常用于机舱泵电动机
互锁控制,System,HAS_COMPONENT,正反转接触器 KM_{F} 和 KM_{B},Component,互锁控制系统包含正反转接触器
双位控制,System,HAS_COMPONENT,压力继电器,Component,双位控制可使用压力继电器
双位控制,System,HAS_COMPONENT,温度继电器,Component,双位控制可使用温度继电器
双位控制,System,HAS_COMPONENT,液位继电器,Component,双位控制可使用液位继电器
时间控制,System,HAS_COMPONENT,时间继电器,Component,时间控制系统包含时间继电器
电动机正反转控制电路,System,BELONGS_TO,继电接触器控制系统,System,正反转控制电路是继电接触器控制系统的一部分
正反转控制,System,HAS_COMPONENT,正转接触器 KM_F,Component,正反转控制系统包含正转接触器
正反转控制,System,HAS_COMPONENT,正反转接触器 KM_{F} 和 KM_{B},Component,正反转控制系统包含反转接触器
正反转控制,System,HAS_COMPONENT,正转起动按钮 SB_F,Component,正反转控制系统包含正转起动按钮
正反转控制,System,RELATED_TO,互锁控制,System,正反转控制采用互锁控制方式
互锁控制,System,HAS_COMPONENT,辅触头 KM_F,Component,互锁控制通过接触器辅触头实现
互锁控制,System,HAS_COMPONENT,按钮互锁,System,互锁控制包含按钮互锁方式
互锁控制,System,HAS_COMPONENT,机械互锁,System,互锁控制包含机械互锁方式
救生艇吊艇机,Equipment,HAS_COMPONENT,手摇传动连锁开关 SQ_4,Component,吊艇机包含手摇传动连锁开关
救生艇吊艇机,Equipment,HAS_COMPONENT,机械制动器连锁开关 SQ_3,Component,吊艇机包含机械制动器连锁开关
救生艇吊艇机,Equipment,HAS_COMPONENT,上升控制接触器 KMF,Component,吊艇机包含上升接触器
救生艇吊艇机,Equipment,HAS_COMPONENT,下降控制接触器 KMB,Component,吊艇机包含下降接触器
救生艇吊艇机,Equipment,HAS_COMPONENT,"终点开关 SQ_1,SQ_2",Component,吊艇机包含终点限位开关
机械制动器连锁开关 SQ_3,Component,HAS_SAFETY_NOTE,防止电动机堵转,SafetyNote,SQ_3用于防止制动时电动机堵转
海（淡）水柜,Equipment,HAS_COMPONENT,压力继电器 SP(H),Component,水柜水位控制包含高压压力继电器
海（淡）水柜,Equipment,HAS_COMPONENT,接触器 KM_{1},Component,水柜水位控制包含水泵接触器
压力双位控制,System,HAS_COMPONENT,压力继电器 SP(H),Component,压力双位控制使用高压压力继电器
空压机,Equipment,HAS_COMPONENT,手动/自动转换开关,Component,空压机控制包含模式转换开关
空压机,Equipment,HAS_COMPONENT,隔离开关 QS,Component,空压机控制包含电源隔离开关
空压机,Equipment,HAS_COMPONENT,残气泄放电磁阀 YV_3,Component,空压机控制包含残气泄放阀
空压机,Equipment,HAS_COMPONENT,继电器 KA,Component,空压机控制包含控制继电器
空压机,Equipment,HAS_COMPONENT,冷却水电磁阀 YV_1,Component,空压机控制包含冷却水电磁阀
空压机,Equipment,HAS_COMPONENT,冷却水压力开关 SP_w,Component,空压机控制包含冷却水压力开关
