head,head_label,relation,tail,tail_label,description
过电流（或电磁）脱扣器失调,FaultCause,REPAIRED_BY,校正调整至要求值,RepairMethod,修复过电流脱扣器失调的方法
热脱扣器动作后未复位,FaultCause,REPAIRED_BY,停1~2s，待热元件复位,RepairMethod,使热脱扣器复位的方法
AOJ-1s过电流脱扣器,Component,HAS_PARAMETER,基准电流,Parameter,过电流脱扣器具有基准电流参数
AOJ-1s过电流脱扣器,Component,HAS_PARAMETER,CT变比,Parameter,过电流脱扣器具有CT变比参数
发电机,Equipment,HAS_FAULT,发电机主开关不能合闸,FaultPhenomenon,发电机可能出现主开关不能合闸的故障
发电机,Equipment,HAS_FAULT,主开关合闸后电网无电压,FaultPhenomenon,发电机可能出现主开关合闸后电网无电压的故障
岸电箱,Equipment,HAS_COMPONENT,岸电电源指示灯,Component,岸电箱上装有岸电电源指示灯
岸电箱,Equipment,HAS_COMPONENT,相序测定器,Equipment,岸电箱上装有相序测定器
岸电箱,Equipment,HAS_COMPONENT,负序继电器,Component,岸电箱可能装有负序继电器
岸电箱的开关合上即跳闸,FaultPhenomenon,CAUSED_BY,相序不一致,FaultPhenomenon,开关跳闸由相序不一致引起
负序继电器,Component,DIAGNOSED_BY,相序测定器,Equipment,负序继电器通过相序测定器检测相序
无功功率分配不均,FaultPhenomenon,DIAGNOSED_BY,电流表,Component,无功功率分配不均可通过电流表指示差异判断
船舶电站,System,HAS_SAFETY_NOTE,短暂的并联运行,SafetyNote,船舶电站中船电与岸电并联仅允许短暂运行
并联运行,System,BELONGS_TO,船舶电站,System,并联运行是船舶电站的一种运行状态
发电机,Equipment,HAS_COMPONENT,功率表（有功）,Component,发电机装有有功功率表
发电机,Equipment,HAS_COMPONENT,功率因数表（cosφ表）,Component,发电机装有功率因数表
发电机,Equipment,HAS_FAULT,无功功率分配不均,FaultPhenomenon,发电机并联运行时可能出现无功功率分配不均
无功功率分配不均,FaultPhenomenon,CAUSED_BY,均压线断路,FaultPhenomenon,均压线断路会导致无功功率分配不均
无功功率分配不均,FaultPhenomenon,DIAGNOSED_BY,检查均压线接触器是否通电动作,DiagnosticMethod,通过检查接触器状态诊断故障
无功功率分配不均,FaultPhenomenon,DIAGNOSED_BY,检查均压线接触器触点是否可靠闭合,DiagnosticMethod,通过检查触点状态诊断故障
均压线断路,FaultPhenomenon,REPAIRED_BY,修复或更新,RepairMethod,通过修复或更新部件解决断路
均压线断路,FaultPhenomenon,REPAIRED_BY,打磨修理,RepairMethod,通过打磨触点解决接触不良
并车失败,FaultPhenomenon,CAUSED_BY,冲击电流,FaultPhenomenon,冲击电流可能导致并车失败和跳闸
并车失败,FaultPhenomenon,CAUSED_BY,逆功率运行,FaultPhenomenon,逆功率运行会导致保护跳闸，并车失败
发电机,Equipment,HAS_COMPONENT,过载保护,Component,发电机配备过载保护装置
过载保护,Component,HAS_COMPONENT,优先脱扣,Component,过载保护包含优先脱扣功能
过载保护,Component,HAS_COMPONENT,自动分级卸载装置,Component,过载保护可通过自动分级卸载实现
发电机主开关,Component,HAS_COMPONENT,过电流脱扣器,Component,主开关内有过电流脱扣器
过电流脱扣器,Component,HAS_COMPONENT,短延时脱扣器,Component,过电流脱扣器包含长延时功能部件
船舶电站,System,HAS_COMPONENT,发电机,Equipment,船舶电站包含发电机
船舶电站,System,HAS_SAFETY_NOTE,避免在负载剧烈变化时并车,SafetyNote,电站操作的安全注意事项
船舶电站,System,HAS_SAFETY_NOTE,不能空载或轻载并车,SafetyNote,电站操作的安全注意事项
船舶电站,System,HAS_SAFETY_NOTE,并车后须及时转移负载,SafetyNote,电站操作的安全注意事项
船舶电站,System,HAS_SAFETY_NOTE,粗同步并车合闸时刻的选择,SafetyNote,粗同步并车的操作要求
发电机,Equipment,HAS_PARAMETER,额定电流,Parameter,发电机有额定电流参数
过载保护,Component,HAS_PARAMETER,长延时整定电流,Parameter,过载保护需要整定长延时电流值
优先脱扣,Component,HAS_PARAMETER,优先脱扣整定电流,Parameter,优先脱扣需要整定动作电流值
优先脱扣,Component,HAS_PARAMETER,延时时间,Parameter,优先脱扣需要整定延时时间
均压线,Component,BELONGS_TO,直流均压连接,Component,均压线是直流均压连接的组成部分
电流稳定装置,Component,BELONGS_TO,自动电压调整器,Component,电流稳定装置是调压器的一部分
自动电压调整器,Component,HAS_PARAMETER,调差系数,Parameter,电压调整器有调差系数参数
发电机,Equipment,HAS_FAULT,外部短路故障,FaultPhenomenon,发电机可能发生外部短路故障
外部短路故障,FaultPhenomenon,REPAIRED_BY,自动空气断路器,Equipment,外部短路故障由自动空气断路器保护动作
自动空气断路器,Equipment,HAS_COMPONENT,过电流脱扣器,Component,自动空气断路器包含过电流脱扣器
外部短路故障,FaultPhenomenon,DIAGNOSED_BY,AH主开关,Equipment,通过AH主开关进行短路保护试验
AH主开关,Equipment,HAS_COMPONENT,电子脱扣器,Component,AH主开关包含电子脱扣器
电子脱扣器,Component,HAS_PARAMETER,短路电流达2~2.5倍的额定电流,Parameter,电子脱扣器设定短延时动作电流值
电子脱扣器,Component,HAS_PARAMETER,延时0.2~0.6s,Parameter,电子脱扣器设定短延时动作时间
发电机,Equipment,HAS_FAULT,欠压保护,FaultPhenomenon,发电机需要欠压保护
欠压保护,FaultPhenomenon,REPAIRED_BY,自动空气断路器,Equipment,欠压保护由自动空气断路器实现
自动空气断路器,Equipment,HAS_COMPONENT,失压脱扣器,Component,自动空气断路器包含失压脱扣器
失压脱扣器,Component,HAS_PARAMETER,电压低于额定电压的70%~80%,Parameter,带延时欠压保护动作电压设定
失压脱扣器,Component,HAS_PARAMETER,延时1~3s,Parameter,带延时欠压保护动作时间设定
发电机,Equipment,HAS_FAULT,逆功率保护,FaultPhenomenon,发电机需要逆功率保护
逆功率保护,FaultPhenomenon,REPAIRED_BY,逆功率继电器,Component,逆功率保护由逆功率继电器实现
逆功率继电器,Component,HAS_PARAMETER,额定功率的8%~15%,Parameter,逆功率保护整定值
逆功率继电器,Component,HAS_PARAMETER,延时3~10s,Parameter,逆功率保护动作延时时间
主柴油发电机组自动控制系统,System,HAS_COMPONENT,M2000型柴油机控制器,Equipment,控制系统包含M2000控制器
M2000型柴油机控制器,Equipment,RELATED_TO,控制器,Equipment,M2000型柴油机控制器简称控制器
控制器,Equipment,HAS_COMPONENT,转换开关S1,Component,控制器连接工作方式选择开关
控制器,Equipment,HAS_COMPONENT,启动按钮S2,Component,控制器连接手动启动按钮
控制器,Equipment,HAS_COMPONENT,停机按钮S3,Component,控制器连接手动停机按钮
控制器,Equipment,HAS_COMPONENT,启动输出中间继电器K3,Component,控制器输出控制启动继电器
启动输出中间继电器K3,Component,RELATED_TO,启动电磁阀,Component,K3继电器控制启动电磁阀
控制器,Equipment,HAS_COMPONENT,速度传感器SG,Component,控制器接收速度传感器信号
速度传感器SG,Component,RELATED_TO,测速继电器B,Component,SG信号输入测速继电器B
测速继电器B,Component,HAS_PARAMETER,发火转速（33%）,Parameter,测速继电器判断发火转速的阈值
控制器,Equipment,HAS_COMPONENT,运行信号中间继电器K2,Component,控制器输出运行信号继电器
控制器,Equipment,HAS_COMPONENT,停机输出中间继电器K4,Component,控制器输出控制停机继电器
停机输出中间继电器K4,Component,RELATED_TO,停机电磁阀,Component,K4继电器控制停机电磁阀
控制器,Equipment,HAS_COMPONENT,预润滑控制定时电路,Component,控制器包含预润滑定时电路
预润滑控制定时电路,Component,HAS_PARAMETER,间歇30min、动作2min,Parameter,预润滑控制的时间参数
预润滑控制定时电路,Component,RELATED_TO,中间继电器 K6,Component,定时电路通过K5继电器输出
中间继电器 K6,Component,RELATED_TO,预供油泵控制箱,Equipment,K5继电器控制预供油泵控制箱
控制器,Equipment,HAS_FAULT,启动失败,FaultPhenomenon,控制器监测启动失败故障
控制器,Equipment,HAS_FAULT,超速,FaultPhenomenon,控制器监测超速故障
控制器,Equipment,HAS_FAULT,滑油低压,FaultPhenomenon,控制器监测滑油低压故障
控制器,Equipment,HAS_FAULT,冷却水高温,FaultPhenomenon,控制器监测冷却水高温故障
滑油低压,FaultPhenomenon,DIAGNOSED_BY,压力开关,Component,滑油低压由压力开关监测
冷却水高温,FaultPhenomenon,DIAGNOSED_BY,温度开关,Component,冷却水高温由温度开关监测
断线报警,FaultPhenomenon,DIAGNOSED_BY,检测电流回路,Component,通过检测电流回路监视线路是否完好
常开信号接点,Component,HAS_COMPONENT,3.3kΩ电阻,Component,常开信号接点两端并联3.3kΩ电阻
3.3kΩ电阻,Component,RELATED_TO,检测电流回路,Component,电阻构成检测电流回路
故障信号阻塞,DiagnosticMethod,RELATED_TO,滑油压力,Parameter,对滑油压力等参数在机器不运行和启动时进行阻塞
滑油压力,Parameter,CAUSED_BY,转速故障,FaultPhenomenon,滑油有压力但无机器运转信号导致转速故障
转速故障,FaultPhenomenon,DIAGNOSED_BY,超速显示条,Component,转速故障显示在超速显示条上
转换干触点输出,Component,RELATED_TO,中间继电器 K6,Component,常闭触点控制中间继电器K6
蓄电池,Component,HAS_COMPONENT,K1,Component,蓄电池供电由K1监视
电站自动控制系统,System,HAS_COMPONENT,GAC-5型发电机自动控制系统,Equipment,电站自动控制系统包含GAC-5型发电机自动控制系统
GAC-5型发电机自动控制系统,Equipment,HAS_COMPONENT,控制单元,Component,GAC-5系统包含控制单元
GAC-5型发电机自动控制系统,Equipment,HAS_COMPONENT,备机选择开关 S1,Component,GAC-5系统包含备机选择开关S1
电网故障,FaultPhenomenon,HAS_SAFETY_NOTE,连续供电,SafetyNote,处理电网故障时应遵循连续供电原则
电网故障,FaultPhenomenon,HAS_PARAMETER,电压故障监测值,Parameter,电网故障处理依据电压故障监测值
电网故障,FaultPhenomenon,HAS_PARAMETER,频率故障监测值,Parameter,电网故障处理依据频率故障监测值
起励、合闸失败,FaultPhenomenon,RELATED_TO,起励失败,FaultPhenomenon,起励、合闸失败报警信号包含起励失败
起励、合闸失败,FaultPhenomenon,RELATED_TO,自动同步失败,FaultPhenomenon,起励、合闸失败报警信号包含自动同步失败
起励、合闸失败,FaultPhenomenon,RELATED_TO,合闸失败,FaultPhenomenon,起励、合闸失败报警信号包含合闸失败
主配电板,Equipment,HAS_COMPONENT,ACB1,Component,主配电板包含供电开关ACB1
应急电力系统,System,HAS_COMPONENT,ACB2,Component,应急电力系统包含供电开关ACB2
ACB1,Component,HAS_COMPONENT,报警辅触头,Component,ACB1具有报警辅助触点
ACB1,Component,HAS_COMPONENT,失压线圈,Component,ACB1具有失压脱扣线圈
ACB2,Component,HAS_COMPONENT,失压线圈,Component,ACB2具有失压脱扣线圈
供电自动转换功能,System,DIAGNOSED_BY,模拟失电,DiagnosticMethod,通过模拟失电检查自动转换功能
手动、自动选择开关,Component,RELATED_TO,S14,Component,选择开关具体为S14
S14,Component,CONTROLS,K34,Component,S14设定控制K34动作
应急电力系统,System,HAS_PARAMETER,手动状态,Parameter,系统具有手动工作状态
应急电力系统,System,HAS_PARAMETER,自动状态,Parameter,系统具有自动工作状态
应急电力系统,System,HAS_PARAMETER,试验状态,Parameter,系统具有试验工作状态
机旁控制箱,Equipment,HAS_COMPONENT,控制开关,Component,控制箱上装有控制开关
