entity_id,name,label,description,doc_id,chunk_id,all_labels,source
ENT_000456,发动机安全管理系统_润滑系统_燃油含量,Parameter,机油中燃油混入含量的关键监测参数,D16维护保养手册,D16维护保养手册::chunk_7,,D16维护保养手册.md
ENT_000457,发动机安全管理系统_润滑系统_金属颗粒物,Parameter,机油中因磨损产生的金属颗粒数量参数,D16维护保养手册,D16维护保养手册::chunk_7,,D16维护保养手册.md
ENT_000458,发动机安全管理系统_燃油系统_FAME 含量限制,Parameter,存储期间燃油中生物柴油含量的百分比限制参数,D16维护保养手册,D16维护保养手册::chunk_20;D16维护保养手册::chunk_21;D16维护保养手册::chunk_22;D16维护保养手册::chunk_23,,D16维护保养手册.md
ENT_000459,发动机安全管理系统_燃油系统_全负载压降参数,Parameter,过滤器全负载时更换阈值压降参数,D16维护保养手册,D16维护保养手册::chunk_11,,D16维护保养手册.md
ENT_000460,发动机安全管理系统_燃油系统_怠速压降参数,Parameter,过滤器怠速时更换阈值压降参数,D16维护保养手册,D16维护保养手册::chunk_11,,D16维护保养手册.md
ENT_000461,发动机安全管理系统_电池_端子紧固扭矩,Parameter,电池电缆端子连接时的标准紧固力矩为 6 牛米,D16维护保养手册,D16维护保养手册::chunk_24;D16维护保养手册::chunk_25;D16维护保养手册::chunk_26;D16维护保养手册::chunk_27,,D16维护保养手册.md
ENT_000462,发动机安全管理系统_通用紧固扭矩标准,Parameter,M6 至 M16 标准螺栓的紧固扭矩技术参数表,D16维护保养手册,D16维护保养手册::chunk_4,,D16维护保养手册.md
ENT_000463,Marine Engine System_RepairMethod_Bleed Fuel System,RepairMethod,更换过滤器或长时间停机后对燃油系统排气的维修操作,D8操作手册,D8操作手册::chunk_25,,D8操作手册.md
ENT_000464,Marine Engine System_RepairMethod_Calibrate Drive Unit Direct,RepairMethod,执行驱动装置直接校准的维修操作步骤,D8操作手册,D8操作手册::chunk_30,,D8操作手册.md
ENT_000465,Marine Engine System_RepairMethod_Calibrate Fuel Tank,RepairMethod,通过多点或满箱校正程序重置燃油油位传感器读数的维修方法,D8操作手册,D8操作手册::chunk_29,,D8操作手册.md
ENT_000466,Marine Engine System_RepairMethod_Calibrate Joystick Docking,RepairMethod,执行操纵杆入坞模式校准的具体维修操作步骤,D8操作手册,D8操作手册::chunk_30,,D8操作手册.md
ENT_000467,Marine Engine System_RepairMethod_Charge Battery,RepairMethod,对电池进行定期充电维护,D8操作手册,D8操作手册::chunk_28,,D8操作手册.md
ENT_000468,Marine Engine System_RepairMethod_Check Coolant Level,RepairMethod,起动发动机前检查和填充冷却剂液位的维护方法,D8操作手册,D8操作手册::chunk_30,,D8操作手册.md
ENT_000469,Marine Engine System_RepairMethod_Check Gear Oil Level,RepairMethod,检查倒档齿轮箱油位是否在标记间,D8操作手册,D8操作手册::chunk_28,,D8操作手册.md
ENT_000470,Marine Engine System_RepairMethod_Clean Battery Terminals,RepairMethod,清除电池电极氧化物并润滑终端,D8操作手册,D8操作手册::chunk_28,,D8操作手册.md
ENT_000471,Marine Engine System_RepairMethod_Clean Fire Hazard,RepairMethod,清除发动机室内积聚的燃油、机油和油脂,D8操作手册,D8操作手册::chunk_24,,D8操作手册.md
ENT_000472,Marine Engine System_RepairMethod_Clean Sea Water Filter,RepairMethod,清洁海水过滤器塞子和密封板,D8操作手册,D8操作手册::chunk_28,,D8操作手册.md
ENT_000473,Marine Engine System_RepairMethod_Drain Water Separator,RepairMethod,打开旋塞排出聚水器中水和污染物的维护操作,D8操作手册,D8操作手册::chunk_25,,D8操作手册.md
ENT_000474,Marine Engine System_RepairMethod_Flush Fuel Tank,RepairMethod,闲置超过 4 周后冲洗燃油箱和系统,D8操作手册,D8操作手册::chunk_31,,D8操作手册.md
ENT_000475,Marine Engine System_RepairMethod_Manage Keys,RepairMethod,在系统中添加、移除或检查电子钥匙授权的管理操作,D8操作手册,D8操作手册::chunk_29,,D8操作手册.md
ENT_000476,Marine Engine System_RepairMethod_Mix Coolant With Distilled Water,RepairMethod,将冷却剂与蒸馏去离子水混合的维修处理方法,D8操作手册,D8操作手册::chunk_26;D8操作手册::chunk_27,,D8操作手册.md
ENT_000477,Marine Engine System_RepairMethod_Release Pressure Before Cap Removal,RepairMethod,移除冷却剂盖前小心释放系统压力的维修步骤,D8操作手册,D8操作手册::chunk_26;D8操作手册::chunk_27,,D8操作手册.md
ENT_000478,Marine Engine System_RepairMethod_Replace Drive Belt,RepairMethod,更换磨损或破裂的传动皮带,D8操作手册,D8操作手册::chunk_24,,D8操作手册.md
ENT_000479,Marine Engine System_RepairMethod_Replace Fuel Hoses Seals,RepairMethod,转换燃料类型时更换软管和密封件,D8操作手册,D8操作手册::chunk_31,,D8操作手册.md
ENT_000480,Marine Engine System_RepairMethod_Replace Impeller,RepairMethod,更换海水泵损坏叶轮的操作,D8操作手册,D8操作手册::chunk_28,,D8操作手册.md
ENT_000481,RepairMethod_Adjust Friction Brake,RepairMethod,通过顺时针或逆时针转动螺丝调整控制杆摩擦制动器以改变移动阻力,D8操作手册,D8操作手册::chunk_15,,D8操作手册.md
ENT_000482,RepairMethod_Adjust Speed Factor,RepairMethod,调整速度系数以校正速度计显示值的维修方法,D8操作手册,D8操作手册::chunk_12,,D8操作手册.md
ENT_000483,RepairMethod_Calibrate System,RepairMethod,校准系统方法，用于校正速度因子、深度和燃油箱数据,D8操作手册,D8操作手册::chunk_13,,D8操作手册.md
ENT_000484,RepairMethod_Lockout And Tagout,RepairMethod,通过关闭电源并锁止主开关进行维修隔离的方法,D8操作手册,D8操作手册::chunk_0,,D8操作手册.md
ENT_000485,RepairMethod_Proper Waste Disposal,RepairMethod,将废油、过滤器等有害废物送至核准设施处理的方法,D8操作手册,D8操作手册::chunk_0,,D8操作手册.md
ENT_000486,RepairMethod_Qualified Workshop Repair,RepairMethod,由合格车间对喷射泵和喷油器进行维修,D8操作手册,D8操作手册::chunk_10;D8操作手册::chunk_11;D8操作手册::chunk_8;D8操作手册::chunk_9,,D8操作手册.md
ENT_000487,RepairMethod_Replace Instrument,RepairMethod,更换仪表方法，通过菜单选择更换前一个仪表,D8操作手册,D8操作手册::chunk_13,,D8操作手册.md
ENT_000488,RepairMethod_Reset Battery Sensor,RepairMethod,更换电池或传感器后重置电流值的维修操作,D8操作手册,D8操作手册::chunk_18,,D8操作手册.md
ENT_000489,RepairMethod_Reset Trip Computer,RepairMethod,重置行程计算机所有参数的维修操作,D8操作手册,D8操作手册::chunk_12,,D8操作手册.md
ENT_000490,RepairMethod_Software Update,RepairMethod,通过更新软件来修复或影响发动机控制功能的方法,D8操作手册,D8操作手册::chunk_7,,D8操作手册.md
ENT_000491,RepairMethod_Stop Engine Via Auxiliary Device,RepairMethod,在正常程序失效时使用辅助装置紧急停机,D8操作手册,D8操作手册::chunk_22,,D8操作手册.md
ENT_000492,RepairMethod_Stop Engine Via Electronic Key Panel,RepairMethod,通过电子钥匙面板执行停机及点火关闭流程,D8操作手册,D8操作手册::chunk_22,,D8操作手册.md
ENT_000493,RepairMethod_Stop Engine Via Start Stop Panel,RepairMethod,通过起动停止面板执行正常停机操作流程,D8操作手册,D8操作手册::chunk_22,,D8操作手册.md
ENT_000494,RepairMethod_Use Screen Cover,RepairMethod,使用保护盖防止屏幕损坏的维护措施,D8操作手册,D8操作手册::chunk_12,,D8操作手册.md
ENT_000495,RepairMethod_Warm Up Engine,RepairMethod,在低负载下使发动机暖机至正常工作温度的操作方法,D8操作手册,D8操作手册::chunk_21,,D8操作手册.md
ENT_000496,Volvo Penta Engine_Cooling System_Charge Air Cooler Cleaning,RepairMethod,拆卸并清洁增压空气冷却器及更换垫片,D8维护保养手册,D8维护保养手册::chunk_14,,D8维护保养手册.md
ENT_000497,Volvo Penta Engine_Lubrication System_Oil And Filter Replacement,RepairMethod,更换发动机机油和过滤器的维修方法，包含扭矩要求；拆卸旧机油过滤器并安装新过滤器的维修方法,D8维护保养手册,D8维护保养手册::chunk_12;D8维护保养手册::chunk_16,,D8维护保养手册.md
ENT_000498,Volvo Penta Engine_Maintenance_Alternator Drying,RepairMethod,交流发电机进水后干燥处理,D8维护保养手册,D8维护保养手册::chunk_25;D8维护保养手册::chunk_26;D8维护保养手册::chunk_27;D8维护保养手册::chunk_28,,D8维护保养手册.md
ENT_000499,Volvo Penta Engine_Maintenance_Battery Replacement Procedure,RepairMethod,更换电池时的拆装步骤及扭矩规范操作流程,D8维护保养手册,D8维护保养手册::chunk_29;D8维护保养手册::chunk_30,,D8维护保养手册.md
ENT_000500,Volvo Penta Engine_Maintenance_Battery Terminal Cleaning,RepairMethod,使用铜刷清除电池电极氧化物并润滑端子的维护方法,D8维护保养手册,D8维护保养手册::chunk_29;D8维护保养手册::chunk_30,,D8维护保养手册.md
ENT_000501,Volvo Penta Engine_Maintenance_Engine Room Cleaning,RepairMethod,发动机舱清洁维护程序,D8维护保养手册,D8维护保养手册::chunk_25;D8维护保养手册::chunk_26;D8维护保养手册::chunk_27;D8维护保养手册::chunk_28,,D8维护保养手册.md
ENT_000502,Volvo Penta Engine_Maintenance_High Pressure Washing,RepairMethod,高压清洗维护方法,D8维护保养手册,D8维护保养手册::chunk_25;D8维护保养手册::chunk_26;D8维护保养手册::chunk_27;D8维护保养手册::chunk_28,,D8维护保养手册.md
ENT_000503,Volvo Penta Engine_Maintenance_Long Term Storage Preparation,RepairMethod,长期存储前的发动机保护与保养操作流程,D8维护保养手册,D8维护保养手册::chunk_22;D8维护保养手册::chunk_23,,D8维护保养手册.md
ENT_000504,Volvo Penta Engine_Maintenance_Post Storage Start Procedure,RepairMethod,长期存储后恢复使用前的起动与检查流程,D8维护保养手册,D8维护保养手册::chunk_22;D8维护保养手册::chunk_23,,D8维护保养手册.md
ENT_000505,Volvo Penta Engine_Maintenance_Storage Periodic Engine Start,RepairMethod,长期存储期间每六个月起动发动机暖机的维护程序,D8维护保养手册,D8维护保养手册::chunk_29;D8维护保养手册::chunk_30,,D8维护保养手册.md
ENT_000506,Volvo Penta Engine_Repair_Air Filter Replacement,RepairMethod,空气过滤器更换步骤，旧件不可清洁,D8维护保养手册,D8维护保养手册::chunk_10;D8维护保养手册::chunk_11,,D8维护保养手册.md
ENT_000507,Volvo Penta Engine_Repair_Engine Block Replacement,RepairMethod,当气缸测量不合格或缸套不可更换时更换发动机缸体的操作,D8维护保养手册,D8维护保养手册::chunk_6,,D8维护保养手册.md
ENT_000508,Volvo Penta Engine_Repair_Engine Lifting Procedure,RepairMethod,使用提升设备拆卸大型部件的维修操作程序,D8维护保养手册,D8维护保养手册::chunk_4;D8维护保养手册::chunk_5,,D8维护保养手册.md
ENT_000509,Volvo Penta Engine_Repair_Fuel Pipe Replacement,RepairMethod,损坏燃油高压管路的更换维修方法,D8维护保养手册,D8维护保养手册::chunk_4;D8维护保养手册::chunk_5,,D8维护保养手册.md
ENT_000510,Volvo Penta Engine_Repair_Piston Installation,RepairMethod,在气缸测量合格后安装新活塞的维修操作,D8维护保养手册,D8维护保养手册::chunk_6,,D8维护保养手册.md
ENT_000511,Volvo Penta Engine_Repair_Post Use Leak And Function Check,RepairMethod,发动机使用后的泄漏与功能检查维修程序,D8维护保养手册,D8维护保养手册::chunk_4;D8维护保养手册::chunk_5,,D8维护保养手册.md
ENT_000512,Volvo Penta Engine_Steering System_Electric Steering Unit_Oil Change,RepairMethod,按照维护计划周期从油尺孔抽出并更换电动操舵器机油,D8维护保养手册,D8维护保养手册::chunk_21,,D8维护保养手册.md
ENT_000513,Volvo Penta Engine_Transmission System_Anode Replacement,RepairMethod,当阳极消耗 50% 时进行更换并激活表面；当阳极消耗 50% 时更换新阳极的维修方法,D8维护保养手册,D8维护保养手册::chunk_14;D8维护保养手册::chunk_16,,D8维护保养手册.md
ENT_000514,Volvo Penta Engine_Transmission System_Clamping Ring Cleaning,RepairMethod,清洁夹紧环表面氧化和碎屑的维修处理,D8维护保养手册,D8维护保养手册::chunk_15,,D8维护保养手册.md
ENT_000515,Volvo Penta Engine_Transmission System_Exhaust Gasket Replacement,RepairMethod,更换损坏的排气衬垫的维修处理,D8维护保养手册,D8维护保养手册::chunk_15,,D8维护保养手册.md
ENT_000516,Volvo Penta Engine_Transmission System_IPS Drive Painting,RepairMethod,给 IPS 传动装置涂抹防污涂料的维护方法,D8维护保养手册,D8维护保养手册::chunk_16,,D8维护保养手册.md
ENT_000517,Volvo Penta Engine_Transmission System_Oil And Filter Maintenance,RepairMethod,变速箱机油与过滤器的联合更换维护程序,D8维护保养手册,D8维护保养手册::chunk_17;D8维护保养手册::chunk_18;D8维护保养手册::chunk_19;D8维护保养手册::chunk_20,,D8维护保养手册.md
ENT_000518,Volvo Penta Engine_Transmission System_Oil Quality Sensor Calibration,RepairMethod,更换机油后对油质量传感器进行重新校准的程序,D8维护保养手册,D8维护保养手册::chunk_16,,D8维护保养手册.md
ENT_000519,Volvo Penta Engine_Transmission System_Oil Quality Sensor Cleaning,RepairMethod,拆卸并使用清洁剂清洁油质量传感器的维修方法,D8维护保养手册,D8维护保养手册::chunk_16,,D8维护保养手册.md
ENT_000520,Volvo Penta Engine_Transmission System_Overhaul,RepairMethod,对发动机进行全面拆解、检查、修复或更换核心部件的维修过程；传动装置的全面大修维修方法,D8维护保养手册,D8维护保养手册::chunk_6;D8维护保养手册::chunk_7;D8维护保养手册::chunk_8,,D8维护保养手册.md
ENT_000521,Volvo Penta Engine_Transmission System_Propeller Shaft Seal Replacement,RepairMethod,更换螺旋桨轴密封件的维修项目,D8维护保养手册,D8维护保养手册::chunk_16,,D8维护保养手册.md
ENT_000522,Volvo Penta Engine_Transmission System_Shaft Lubrication,RepairMethod,对螺旋桨轴进行润滑脂润滑的维护操作,D8维护保养手册,D8维护保养手册::chunk_17;D8维护保养手册::chunk_18;D8维护保养手册::chunk_19;D8维护保养手册::chunk_20,,D8维护保养手册.md
ENT_000523,Volvo Penta Engine_Transmission System_Stuffing Box Replacement,RepairMethod,更换轴填料函密封件的维修方法,D8维护保养手册,D8维护保养手册::chunk_17;D8维护保养手册::chunk_18;D8维护保养手册::chunk_19;D8维护保养手册::chunk_20,,D8维护保养手册.md
ENT_000524,Volvo Penta Engine_Transmission System_Transmission Oil Change,RepairMethod,变速箱变速器油的更换作业流程,D8维护保养手册,D8维护保养手册::chunk_15,,D8维护保养手册.md
ENT_000525,Volvo Penta Engine_Transmission System_Unit Replacement,RepairMethod,传动装置整体更换的维修处理方法,D8维护保养手册,D8维护保养手册::chunk_7;D8维护保养手册::chunk_8,,D8维护保养手册.md
ENT_000526,发动机安全管理系统_SCR 系统_更换泵过滤器,RepairMethod,针对 SCR 系统泵装置过滤器的拆卸与安装维修操作,D16维护保养手册,D16维护保养手册::chunk_12;D16维护保养手册::chunk_13;D16维护保养手册::chunk_14;D16维护保养手册::chunk_15,,D16维护保养手册.md
ENT_000527,发动机安全管理系统_传动装置_更换倒档机油,RepairMethod,排出旧机油并加注新机油至量油尺标记间的维护操作,D16维护保养手册,D16维护保养手册::chunk_20;D16维护保养手册::chunk_21;D16维护保养手册::chunk_22;D16维护保养手册::chunk_23,,D16维护保养手册.md
ENT_000528,发动机安全管理系统_传动装置_更换倒档过滤器,RepairMethod,拆卸旧机油过滤器并安装新过滤器的维护操作,D16维护保养手册,D16维护保养手册::chunk_20;D16维护保养手册::chunk_21;D16维护保养手册::chunk_22;D16维护保养手册::chunk_23,,D16维护保养手册.md
ENT_000529,发动机安全管理系统_传动装置_真空泵清洁,RepairMethod,切断软管、擦拭泵体、O 型圈涂硅脂及压缩空气清洁的维护流程,D16维护保养手册,D16维护保养手册::chunk_8,,D16维护保养手册.md
ENT_000530,发动机安全管理系统_冷却系统_加满冷却剂,RepairMethod,向冷却系统膨胀箱注满符合规格冷却剂的维修操作；冷却系统液位检查并加注冷却剂的维护方法；打开排水点排出发动机及冷却系统旧冷却剂的操作；使用淡水冲洗冷却系统以去除沉积物和碎屑的操作,D16维护保养手册,D16维护保养手册::chunk_12;D16维护保养手册::chunk_13;D16维护保养手册::chunk_14;D16维护保养手册::chunk_15;D16维护保养手册::chunk_16;D16维护保养手册::chunk_17;D16维护保养手册::chunk_18;D16维护保养手册::chunk_19,,D16维护保养手册.md
ENT_000531,发动机安全管理系统_冷却系统_拆卸叶轮储存,RepairMethod,海水泵叶轮的拆卸检查与更换维修操作；从海水过滤泵拆下叶轮并密封冷藏的存储保护措施,D16维护保养手册,D16维护保养手册::chunk_16;D16维护保养手册::chunk_17;D16维护保养手册::chunk_18;D16维护保养手册::chunk_19;D16维护保养手册::chunk_20;D16维护保养手册::chunk_21;D16维护保养手册::chunk_22;D16维护保养手册::chunk_23,,D16维护保养手册.md
ENT_000532,发动机安全管理系统_冷却系统_排放残余海水,RepairMethod,存储前排放热交换器及软管中残余海水的防冻操作,D16维护保养手册,D16维护保养手册::chunk_20;D16维护保养手册::chunk_21;D16维护保养手册::chunk_22;D16维护保养手册::chunk_23,,D16维护保养手册.md
ENT_000533,发动机安全管理系统_冷却系统_更换阳极,RepairMethod,检查锌阳极尺寸并更换磨损超过一半的阳极部件,D16维护保养手册,D16维护保养手册::chunk_20;D16维护保养手册::chunk_21;D16维护保养手册::chunk_22;D16维护保养手册::chunk_23,,D16维护保养手册.md
ENT_000534,发动机安全管理系统_冷却系统_清洁海水过滤器,RepairMethod,关闭通海旋塞后拆卸滤芯清洁并重新安装的维护操作,D16维护保养手册,D16维护保养手册::chunk_20;D16维护保养手册::chunk_21;D16维护保养手册::chunk_22;D16维护保养手册::chunk_23,,D16维护保养手册.md
ENT_000535,发动机安全管理系统_发动机_交流发电机_吹干处理,RepairMethod,交流发电机进水后使用压缩空气吹干并检查充电功能,D16维护保养手册,D16维护保养手册::chunk_24;D16维护保养手册::chunk_25;D16维护保养手册::chunk_26;D16维护保养手册::chunk_27,,D16维护保养手册.md
ENT_000536,发动机安全管理系统_发动机_更换传动皮带,RepairMethod,针对发动机传动皮带损坏或破裂的更换维修操作,D16维护保养手册,D16维护保养手册::chunk_16;D16维护保养手册::chunk_17;D16维护保养手册::chunk_18;D16维护保养手册::chunk_19,,D16维护保养手册.md
ENT_000537,发动机安全管理系统_发动机_涡轮增压器更换,RepairMethod,涡轮增压器整体更换维修方法,D16维护保养手册,D16维护保养手册::chunk_11,,D16维护保养手册.md
ENT_000538,发动机安全管理系统_发动机_清洁发动机舱,RepairMethod,定期清洁发动机及机舱以降低过热和磨损风险并检查泄漏,D16维护保养手册,D16维护保养手册::chunk_24;D16维护保养手册::chunk_25;D16维护保养手册::chunk_26;D16维护保养手册::chunk_27,,D16维护保养手册.md
ENT_000539,发动机安全管理系统_发动机_长期存储维护,RepairMethod,针对两个月以上停用期的防冻防腐及电池保护措施,D16维护保养手册,D16维护保养手册::chunk_20;D16维护保养手册::chunk_21;D16维护保养手册::chunk_22;D16维护保养手册::chunk_23,,D16维护保养手册.md
ENT_000540,发动机安全管理系统_排气系统_损坏件更换,RepairMethod,排气系统泄漏损坏件更换方法,D16维护保养手册,D16维护保养手册::chunk_11,,D16维护保养手册.md
ENT_000541,发动机安全管理系统_操舵器_更换机油,RepairMethod,从量油尺孔抽出旧油并加注约 5 升新机油的操作,D16维护保养手册,D16维护保养手册::chunk_20;D16维护保养手册::chunk_21;D16维护保养手册::chunk_22;D16维护保养手册::chunk_23,,D16维护保养手册.md
ENT_000542,发动机安全管理系统_润滑系统_机油补充,RepairMethod,当检查发现油位不足时按技术参数要求加满机油,D16维护保养手册,D16维护保养手册::chunk_6,,D16维护保养手册.md
ENT_000543,发动机安全管理系统_润滑系统_过滤器安装润滑,RepairMethod,安装新过滤器前使用发动机机油润滑过滤器衬垫,D16维护保养手册,D16维护保养手册::chunk_6,,D16维护保养手册.md
ENT_000544,发动机安全管理系统_润滑系统_过滤器拧紧,RepairMethod,按照过滤器说明要求拧紧过滤器以确保密封,D16维护保养手册,D16维护保养手册::chunk_6,,D16维护保养手册.md
ENT_000545,发动机安全管理系统_燃油系统_双联过滤器切换,RepairMethod,双联过滤器运行中切换隔离方法,D16维护保养手册,D16维护保养手册::chunk_11,,D16维护保养手册.md
ENT_000546,发动机安全管理系统_燃油系统_过滤器排气,RepairMethod,通过泄放螺丝和旋塞连接软管排出过滤器内空气的维修操作；燃油过滤器拆卸与安装维修方法；燃油系统高压排气操作流程,D16维护保养手册,D16维护保养手册::chunk_10;D16维护保养手册::chunk_11,,D16维护保养手册.md
ENT_000547,发动机安全管理系统_电池_清洁端子,RepairMethod,使用铜刷清除电池电极和终端上的氧化物并涂抹润滑油,D16维护保养手册,D16维护保养手册::chunk_24;D16维护保养手册::chunk_25;D16维护保养手册::chunk_26;D16维护保养手册::chunk_27,,D16维护保养手册.md
ENT_000548,发动机安全管理系统_预防性保养,RepairMethod,基于分析结果规划的预防性维护措施,D16维护保养手册,D16维护保养手册::chunk_7,,D16维护保养手册.md
ENT_000549,警告标贴维护,RepairMethod,更换损坏或被涂料覆盖的警告和信息标贴以保持清晰可见,D8维护保养手册,D8维护保养手册::chunk_0;D8维护保养手册::chunk_1;D8维护保养手册::chunk_2;D8维护保养手册::chunk_3,,D8维护保养手册.md
ENT_000550,Marine Engine System_SafetyNote_Authorized Service for Fuel Calibration,SafetyNote,燃油箱体积和报警等级设置必须由授权维修站执行的安全禁忌,D8操作手册,D8操作手册::chunk_29,,D8操作手册.md
ENT_000551,Marine Engine System_SafetyNote_Battery Acid Corrosion,SafetyNote,电池电解液具有腐蚀性需小心处理,D8操作手册,D8操作手册::chunk_28,,D8操作手册.md
ENT_000552,Marine Engine System_SafetyNote_Battery Ventilation,SafetyNote,电池工作前需对发动机舱通风,D8操作手册,D8操作手册::chunk_28,,D8操作手册.md
ENT_000553,Marine Engine System_SafetyNote_Close Sea Cock Before Operation,SafetyNote,操作海水系统前必须关闭通海旋塞,D8操作手册,D8操作手册::chunk_28,,D8操作手册.md
ENT_000554,Marine Engine System_SafetyNote_Engine Cooled Before Fuel Work,SafetyNote,对燃料系统操作前确保发动机已冷却的防火要求,D8操作手册,D8操作手册::chunk_25,,D8操作手册.md
ENT_000555,Marine Engine System_SafetyNote_Engine Horizontal For Oil Check,SafetyNote,检查油位时必须将发动机置于水平位置的安全要求,D8操作手册,D8操作手册::chunk_25,,D8操作手册.md
ENT_000556,Marine Engine System_SafetyNote_Fix Leak Before Start,SafetyNote,检测到泄漏时在起动发动机前必须调查原因并纠正,D8操作手册,D8操作手册::chunk_24,,D8操作手册.md
ENT_000557,Marine Engine System_SafetyNote_Fuel Level Limit for Calibration,SafetyNote,进行多点校准时燃油不得超过总容量 20% 的操作限制,D8操作手册,D8操作手册::chunk_29,,D8操作手册.md
ENT_000558,Marine Engine System_SafetyNote_Fuel Rag Fire Hazard,SafetyNote,存放浸有燃油抹布时防止自燃的安全警示,D8操作手册,D8操作手册::chunk_25,,D8操作手册.md
ENT_000559,Marine Engine System_SafetyNote_Fuel Spill Clean,SafetyNote,立即清除油漆表面生物柴油以防损坏,D8操作手册,D8操作手册::chunk_31,,D8操作手册.md
ENT_000560,Marine Engine System_SafetyNote_Ignition Off Calibration Confirm,SafetyNote,校准完成后必须关闭点火开关至少 15 分钟以确认,D8操作手册,D8操作手册::chunk_30,,D8操作手册.md
ENT_000561,Marine Engine System_SafetyNote_Joystick Calibration Weather,SafetyNote,操纵杆校准需在开阔水域且避免大风湍流环境,D8操作手册,D8操作手册::chunk_30,,D8操作手册.md
ENT_000562,Marine Engine System_SafetyNote_Long Idle Fuel Type,SafetyNote,停机时间较长的发动机禁止使用高 FAME 燃料,D8操作手册,D8操作手册::chunk_31,,D8操作手册.md
ENT_000563,Marine Engine System_SafetyNote_Minimum One Key Required,SafetyNote,系统中必须至少保留一个已注册钥匙以防无法启动的安全要求,D8操作手册,D8操作手册::chunk_29,,D8操作手册.md
