entity_id,name,label,description,doc_id,chunk_id,all_labels,source
ENT_000215,发动机安全管理系统_燃油系统,Equipment,负责发动机燃料供给的独立子系统；发动机燃油供给与管理成套设备,D16维护保养手册,D16维护保养手册::chunk_1;D16维护保养手册::chunk_11,,D16维护保养手册.md
ENT_000216,发动机安全管理系统_电气系统,Equipment,负责全船电气控制与配电的子系统,D16维护保养手册,D16维护保养手册::chunk_1,,D16维护保养手册.md
ENT_000217,发动机安全管理系统_电池,Equipment,为发动机起动和控制电路提供电能的储能设备；系统内的电力存储与启动设备,D16维护保养手册,D16维护保养手册::chunk_0;D16维护保养手册::chunk_1,,D16维护保养手册.md
ENT_000218,FaultCause_Bending Fuel Pipes,FaultCause,违规弯曲燃油高压管路导致物理开裂,D8操作手册,D8操作手册::chunk_5;D8操作手册::chunk_6,,D8操作手册.md
ENT_000219,FaultCause_Chemical Contact,FaultCause,皮肤直接接触有害化学品或油污的原因,D8操作手册,D8操作手册::chunk_0,,D8操作手册.md
ENT_000220,FaultCause_Cold Idling,FaultCause,冷态发动机长时间空转导致的潜在故障诱因,D8操作手册,D8操作手册::chunk_21,,D8操作手册.md
ENT_000221,FaultCause_Cold Weather,FaultCause,气温寒冷导致发动机启动困难,D8操作手册,D8操作手册::chunk_20,,D8操作手册.md
ENT_000222,FaultCause_Component Contamination,FaultCause,系统组件清洁度不足含有污物导致故障的原因,D8操作手册,D8操作手册::chunk_7,,D8操作手册.md
ENT_000223,FaultCause_DPS Antenna Fault,FaultCause,DPS 天线硬件故障导致系统无法激活的原因,D8操作手册,D8操作手册::chunk_18,,D8操作手册.md
ENT_000224,FaultCause_Disconnecting Switch While Running,FaultCause,发动机运行时断开主开关电流导致电气系统冲击,D8操作手册,D8操作手册::chunk_1;D8操作手册::chunk_2;D8操作手册::chunk_3;D8操作手册::chunk_4,,D8操作手册.md
ENT_000225,FaultCause_Electromagnetic Interference,FaultCause,无线电发射机产生的强电磁信号干扰系统运行,D8操作手册,D8操作手册::chunk_17,,D8操作手册.md
ENT_000226,FaultCause_Engine Stop During Maneuver,FaultCause,在倒档操纵期间发动机停止运转的故障诱因,D8操作手册,D8操作手册::chunk_21,,D8操作手册.md
ENT_000227,FaultCause_Environmental Conditions,FaultCause,风浪水流等环境条件导致定位精度下降,D8操作手册,D8操作手册::chunk_17,,D8操作手册.md
ENT_000228,FaultCause_Excessive Trim Angle,FaultCause,过度纵倾角，导致气蚀和螺旋桨松动,D8操作手册,D8操作手册::chunk_14,,D8操作手册.md
ENT_000229,FaultCause_Exhaust Wake Inhalation,FaultCause,船尾低压区将废气吸入驾驶舱导致中毒的原因,D8操作手册,D8操作手册::chunk_7,,D8操作手册.md
ENT_000230,FaultCause_Foreign Objects In Inlet,FaultCause,空气入口管中含有异物或工具遗留导致机械损伤,D8操作手册,D8操作手册::chunk_1;D8操作手册::chunk_2;D8操作手册::chunk_3;D8操作手册::chunk_4,,D8操作手册.md
ENT_000231,FaultCause_Fuel Penetration Into Tissue,FaultCause,高压燃油渗入人体组织导致感染败血病,D8操作手册,D8操作手册::chunk_5;D8操作手册::chunk_6,,D8操作手册.md
ENT_000232,FaultCause_GPS Signal Weakness,FaultCause,GPS 信号强度不足导致定位功能受限的原因,D8操作手册,D8操作手册::chunk_18,,D8操作手册.md
ENT_000233,FaultCause_High Corrosion Environment,FaultCause,高腐蚀环境导致保护系统报警或需要调整模式的原因,D8操作手册,D8操作手册::chunk_18,,D8操作手册.md
ENT_000234,FaultCause_High Pressure Water Cleaning,FaultCause,使用高压水清洗发动机导致的部件损伤,D8操作手册,D8操作手册::chunk_5;D8操作手册::chunk_6,,D8操作手册.md
ENT_000235,FaultCause_High Speed Shifting,FaultCause,在高发动机转速下进行换档操作的故障诱因,D8操作手册,D8操作手册::chunk_21,,D8操作手册.md
ENT_000236,FaultCause_Hot Fluid Or Surface,FaultCause,冷却液或润滑油在高温高压状态下接触人体,D8操作手册,D8操作手册::chunk_1;D8操作手册::chunk_2;D8操作手册::chunk_3;D8操作手册::chunk_4,,D8操作手册.md
ENT_000237,FaultCause_Joystick Not Neutral,FaultCause,操纵杆未处于空档位置导致系统无法接合的原因,D8操作手册,D8操作手册::chunk_18,,D8操作手册.md
ENT_000238,FaultCause_Overload Stress,FaultCause,产品或部件承受过度负载或应力导致损坏,D8操作手册,D8操作手册::chunk_10;D8操作手册::chunk_11;D8操作手册::chunk_8;D8操作手册::chunk_9,,D8操作手册.md
ENT_000239,FaultCause_Prolonged Cranking,FaultCause,起动马达接合时间超过最大激活时限,D8操作手册,D8操作手册::chunk_20,,D8操作手册.md
ENT_000240,FaultCause_Sliding Function Unavailable,FaultCause,滑动功能未校准或故障导致 DPS 无法接合的原因,D8操作手册,D8操作手册::chunk_18,,D8操作手册.md
ENT_000241,FaultCause_Spark Or Open Flame,FaultCause,意外火花、明火或吸烟引发的点火源,D8操作手册,D8操作手册::chunk_0,,D8操作手册.md
ENT_000242,FaultCause_Speed Factor Mismatch,FaultCause,速度系数设置错误导致速度计显示异常的原因；速度因子不匹配原因，导致转速表显示错误值,D8操作手册,D8操作手册::chunk_12;D8操作手册::chunk_13,,D8操作手册.md
ENT_000243,FaultCause_Sunlight Exposure,FaultCause,长期暴露于强烈阳光下导致设备损坏的原因,D8操作手册,D8操作手册::chunk_12,,D8操作手册.md
ENT_000244,FaultCause_Third Party System Fault,FaultCause,使用第三方系统导致的功能损坏或人身伤害,D8操作手册,D8操作手册::chunk_10;D8操作手册::chunk_11;D8操作手册::chunk_8;D8操作手册::chunk_9,,D8操作手册.md
ENT_000245,FaultCause_Unauthorized Modification,FaultCause,未经授权改装发动机、EVC 系统或管路安装,D8操作手册,D8操作手册::chunk_10;D8操作手册::chunk_11;D8操作手册::chunk_8;D8操作手册::chunk_9,,D8操作手册.md
ENT_000246,FaultCause_Vessel Speed Too High,FaultCause,船速超过系统允许的最大激活速度限制的原因,D8操作手册,D8操作手册::chunk_18,,D8操作手册.md
ENT_000247,FaultCause_Wrong Battery Polarity,FaultCause,电池正负极接线错误引发电气设备损坏,D8操作手册,D8操作手册::chunk_5;D8操作手册::chunk_6,,D8操作手册.md
ENT_000248,FaultCause_Wrong Fuel Quality,FaultCause,使用非推荐燃油导致燃料控制机构结合或排放超标,D8操作手册,D8操作手册::chunk_1;D8操作手册::chunk_2;D8操作手册::chunk_3;D8操作手册::chunk_4,,D8操作手册.md
ENT_000249,FaultCause_Wrong Oil Coolant Quality,FaultCause,使用错误粘度机油或不正确混合冷却剂,D8操作手册,D8操作手册::chunk_10;D8操作手册::chunk_11;D8操作手册::chunk_8;D8操作手册::chunk_9,,D8操作手册.md
ENT_000250,Marine Engine System_FaultCause_Air In Fuel System,FaultCause,燃油系统中混入空气导致运行异常的故障原因；燃油中混入水分导致发动机故障的原因,D8操作手册,D8操作手册::chunk_25,,D8操作手册.md
ENT_000251,Marine Engine System_FaultCause_Depth Sensor Failure,FaultCause,因传感器不工作或损坏导致信号丢失的根本原因,D8操作手册,D8操作手册::chunk_29,,D8操作手册.md
ENT_000252,Marine Engine System_FaultCause_Disconnect While Running,FaultCause,发动机运行时断开电路导致的故障,D8操作手册,D8操作手册::chunk_28,,D8操作手册.md
ENT_000253,Marine Engine System_FaultCause_Filter Blockage,FaultCause,海水过滤器被颗粒污泥堵塞,D8操作手册,D8操作手册::chunk_28,,D8操作手册.md
ENT_000254,Marine Engine System_FaultCause_Fuel Corrosion,FaultCause,生物柴油对燃油系统密封件材料的腐蚀,D8操作手册,D8操作手册::chunk_31,,D8操作手册.md
ENT_000255,Marine Engine System_FaultCause_High FAME Content,FaultCause,高含量生物柴油导致的真菌细菌滋生原因,D8操作手册,D8操作手册::chunk_31,,D8操作手册.md
ENT_000256,Marine Engine System_FaultCause_Terminal Oxidation,FaultCause,电池电极氧化物导致接触不良,D8操作手册,D8操作手册::chunk_28,,D8操作手册.md
ENT_000257,Volvo Penta Engine_Fault_Battery Connection Loose,FaultCause,电池连接松动可能导致电气系统损坏的原因,D8维护保养手册,D8维护保养手册::chunk_29;D8维护保养手册::chunk_30,,D8维护保养手册.md
ENT_000258,Volvo Penta Engine_Fault_Battery Terminal Oxidation,FaultCause,电池电极和终端上的污染物和氧化物积累,D8维护保养手册,D8维护保养手册::chunk_29;D8维护保养手册::chunk_30,,D8维护保养手册.md
ENT_000259,Volvo Penta Engine_Fault_Component Contamination,FaultCause,组件表面或内部存在污物导致的故障诱因,D8维护保养手册,D8维护保养手册::chunk_4;D8维护保养手册::chunk_5,,D8维护保养手册.md
ENT_000260,Volvo Penta Engine_Fault_Fuel Pipe Bending,FaultCause,违规弯曲或拉直燃油高压管导致的故障诱因,D8维护保养手册,D8维护保养手册::chunk_4;D8维护保养手册::chunk_5,,D8维护保养手册.md
ENT_000261,Volvo Penta Engine_Fault_Wrong Battery Polarity,FaultCause,电池正负极连接错误导致的故障诱因,D8维护保养手册,D8维护保养手册::chunk_4;D8维护保养手册::chunk_5,,D8维护保养手册.md
ENT_000262,Volvo Penta Engine_Lubrication System_High Oil Level,FaultCause,机油液位过高，可能导致油耗增加或部件损坏,D8维护保养手册,D8维护保养手册::chunk_12,,D8维护保养手册.md
ENT_000263,Volvo Penta Engine_Lubrication System_Low Oil Level,FaultCause,机油液位过低，可能导致润滑不足及发动机过热,D8维护保养手册,D8维护保养手册::chunk_12,,D8维护保养手册.md
ENT_000264,Volvo Penta Engine_Lubrication System_Wrong Oil Filter Type,FaultCause,使用错误类型的机油过滤器，导致磨损增加,D8维护保养手册,D8维护保养手册::chunk_12,,D8维护保养手册.md
ENT_000265,Volvo Penta Engine_Transmission System_Wrong Oil Usage,FaultCause,因使用非指定油品导致的故障诱因,D8维护保养手册,D8维护保养手册::chunk_7;D8维护保养手册::chunk_8,,D8维护保养手册.md
ENT_000266,发动机安全管理系统_发动机_叶轮损坏,FaultCause,涡轮增压器压缩机或涡轮叶轮损坏原因,D16维护保养手册,D16维护保养手册::chunk_11,,D16维护保养手册.md
ENT_000267,发动机安全管理系统_发动机_污物污染,FaultCause,系统组件清洁度不足导致的污物污染原因,D16维护保养手册,D16维护保养手册::chunk_1,,D16维护保养手册.md
ENT_000268,发动机安全管理系统_增压空气系统_泄漏,FaultCause,增压空气管路连接泄漏导致故障的原因,D16维护保养手册,D16维护保养手册::chunk_11,,D16维护保养手册.md
ENT_000269,发动机安全管理系统_意外火花,FaultCause,点燃燃油蒸汽或电池氢气导致爆炸的直接诱因,D16维护保养手册,D16维护保养手册::chunk_0,,D16维护保养手册.md
ENT_000270,发动机安全管理系统_润滑系统_部件磨损,FaultCause,导致机油中出现金属颗粒物的故障原因,D16维护保养手册,D16维护保养手册::chunk_7,,D16维护保养手册.md
ENT_000271,发动机安全管理系统_燃油或气体泄漏,FaultCause,导致火灾爆炸风险的主要诱发原因,D16维护保养手册,D16维护保养手册::chunk_0,,D16维护保养手册.md
ENT_000272,发动机安全管理系统_燃油系统_微生物滋生,FaultCause,因 FAME 生物柴油含量过高导致燃油系统细菌堵塞,D16维护保养手册,D16维护保养手册::chunk_20;D16维护保养手册::chunk_21;D16维护保养手册::chunk_22;D16维护保养手册::chunk_23,,D16维护保养手册.md
ENT_000273,发动机安全管理系统_燃油系统_空气残留,FaultCause,燃油系统中残留空气导致故障的原因,D16维护保养手册,D16维护保养手册::chunk_11,,D16维护保养手册.md
ENT_000274,发动机安全管理系统_燃油系统_高压燃油泄漏,FaultCause,燃油系统高压回路发生泄漏的故障原因,D16维护保养手册,D16维护保养手册::chunk_1,,D16维护保养手册.md
ENT_000275,发动机安全管理系统_电池_长期放电损坏,FaultCause,电池长期处于放电状态会导致损坏及寒冷天气冻结爆裂,D16维护保养手册,D16维护保养手册::chunk_24;D16维护保养手册::chunk_25;D16维护保养手册::chunk_26;D16维护保养手册::chunk_27,,D16维护保养手册.md
ENT_000276,无气门室盖起动,FaultCause,在气门室盖拆下情况下起动发动机造成人身伤害,D8维护保养手册,D8维护保养手册::chunk_0;D8维护保养手册::chunk_1;D8维护保养手册::chunk_2;D8维护保养手册::chunk_3,,D8维护保养手册.md
ENT_000277,运行中断开主开关,FaultCause,发动机正在运行时断开主开关电流导致设备损坏,D8维护保养手册,D8维护保养手册::chunk_0;D8维护保养手册::chunk_1;D8维护保养手册::chunk_2;D8维护保养手册::chunk_3,,D8维护保养手册.md
ENT_000278,FaultPhenomenon_Burns,FaultPhenomenon,人员因接触热流体、热表面或蒸汽导致的灼伤,D8操作手册,D8操作手册::chunk_1;D8操作手册::chunk_2;D8操作手册::chunk_3;D8操作手册::chunk_4,,D8操作手册.md
ENT_000279,FaultPhenomenon_Carbon Monoxide Poisoning,FaultPhenomenon,因船尾湍流吸入废气导致的人员中毒现象,D8操作手册,D8操作手册::chunk_7,,D8操作手册.md
ENT_000280,FaultPhenomenon_Cold Start Smoke,FaultPhenomenon,冷启动烟雾，低温环境下发动机启动时产生的异常排放现象,D8操作手册,D8操作手册::chunk_19,,D8操作手册.md
ENT_000281,FaultPhenomenon_Component Failure,FaultPhenomenon,因污物或清洁不当引起的系统组件功能异常,D8操作手册,D8操作手册::chunk_7,,D8操作手册.md
ENT_000282,FaultPhenomenon_Cooling Inlet Exposure,FaultPhenomenon,冷却剂入口暴露，导致发动机过热,D8操作手册,D8操作手册::chunk_14,,D8操作手册.md
ENT_000283,FaultPhenomenon_Corrosion Danger,FaultPhenomenon,主动防腐蚀保护系统检测到腐蚀风险或无保护状态,D8操作手册,D8操作手册::chunk_18,,D8操作手册.md
ENT_000284,FaultPhenomenon_DPS Activation Failure,FaultPhenomenon,动态定位系统因条件不满足或故障无法激活的现象,D8操作手册,D8操作手册::chunk_18,,D8操作手册.md
ENT_000285,FaultPhenomenon_Electronic Device Damage,FaultPhenomenon,控制单元或电子装置因电气操作不当而损坏,D8操作手册,D8操作手册::chunk_1;D8操作手册::chunk_2;D8操作手册::chunk_3;D8操作手册::chunk_4,,D8操作手册.md
ENT_000286,FaultPhenomenon_Emission Certificate Void,FaultPhenomenon,因维护不当导致发动机排放认证证书无效,D8操作手册,D8操作手册::chunk_10;D8操作手册::chunk_11;D8操作手册::chunk_8;D8操作手册::chunk_9,,D8操作手册.md
ENT_000287,FaultPhenomenon_Engine Overspeed,FaultPhenomenon,发动机转速异常升高，可能导致机械损坏或人身伤害；发动机超速故障，可能导致机械损坏,D8操作手册,D8操作手册::chunk_1;D8操作手册::chunk_14;D8操作手册::chunk_2;D8操作手册::chunk_3;D8操作手册::chunk_4,,D8操作手册.md
ENT_000288,FaultPhenomenon_Engine Start Failure,FaultPhenomenon,发动机无法正常启动的故障现象,D8操作手册,D8操作手册::chunk_20,,D8操作手册.md
ENT_000289,FaultPhenomenon_Fire Or Explosion,FaultPhenomenon,因易燃物遇火花导致的火灾或爆炸事故,D8操作手册,D8操作手册::chunk_0,,D8操作手册.md
ENT_000290,FaultPhenomenon_Fuel Or Oil Leak,FaultPhenomenon,燃油、冷却剂或润滑油出现的泄漏异常症状,D8操作手册,D8操作手册::chunk_0,,D8操作手册.md
ENT_000291,FaultPhenomenon_Fuel Pipe Cracking,FaultPhenomenon,燃油高压管路因外力弯曲产生的裂纹故障,D8操作手册,D8操作手册::chunk_5;D8操作手册::chunk_6,,D8操作手册.md
ENT_000292,FaultPhenomenon_High Fuel Consumption,FaultPhenomenon,磨合期或故障导致的油耗异常增加,D8操作手册,D8操作手册::chunk_10;D8操作手册::chunk_11;D8操作手册::chunk_8;D8操作手册::chunk_9,,D8操作手册.md
ENT_000293,FaultPhenomenon_Mechanical Damage,FaultPhenomenon,发动机内部机械结构因异物进入或操作失误导致的损坏；机械损坏故障，由不当操作或维护引起；因操作不当或碰撞导致的机械损坏现象；发动机部件发生的机械性损坏现象,D8操作手册,D8操作手册::chunk_1;D8操作手册::chunk_14;D8操作手册::chunk_16;D8操作手册::chunk_2;D8操作手册::chunk_21;D8操作手册::chunk_3;D8操作手册::chunk_4,,D8操作手册.md
ENT_000294,FaultPhenomenon_Missed Alarm,FaultPhenomenon,错过警报现象，因暗站模式启用导致无法显示或听到错误消息,D8操作手册,D8操作手册::chunk_13,,D8操作手册.md
ENT_000295,FaultPhenomenon_Propeller Cavitation,FaultPhenomenon,螺旋桨气蚀现象，导致螺旋桨固定松动和效率下降,D8操作手册,D8操作手册::chunk_14,,D8操作手册.md
ENT_000296,FaultPhenomenon_Propeller Loosening,FaultPhenomenon,螺旋桨固定松动，由过度纵倾或气蚀引起,D8操作手册,D8操作手册::chunk_14,,D8操作手册.md
ENT_000297,FaultPhenomenon_Propeller Shaft Rotation Damage,FaultPhenomenon,螺旋桨轴被动转动损坏，发动机停止时轴转动导致的倒档润滑不足故障,D8操作手册,D8操作手册::chunk_19,,D8操作手册.md
ENT_000298,FaultPhenomenon_Screen Damage,FaultPhenomenon,屏幕因环境因素导致的损坏或功能故障,D8操作手册,D8操作手册::chunk_12,,D8操作手册.md
ENT_000299,FaultPhenomenon_Sepsis Infection,FaultPhenomenon,因燃油泄漏接触皮肤引发的败血病感染风险,D8操作手册,D8操作手册::chunk_5;D8操作手册::chunk_6,,D8操作手册.md
ENT_000300,FaultPhenomenon_Shortened Engine Life,FaultPhenomenon,因油品或操作不当导致发动机使用寿命缩短；发动机使用寿命因不当操作而缩短的现象,D8操作手册,D8操作手册::chunk_10;D8操作手册::chunk_11;D8操作手册::chunk_21;D8操作手册::chunk_8;D8操作手册::chunk_9,,D8操作手册.md
ENT_000301,FaultPhenomenon_Skin Damage,FaultPhenomenon,因长期接触油污导致的皮肤发炎或干燥问题,D8操作手册,D8操作手册::chunk_0,,D8操作手册.md
ENT_000302,FaultPhenomenon_Speedometer Error,FaultPhenomenon,速度计显示值与实际值不符的故障现象；转速表错误现象，显示的错误值无法通过调整速度校正进行校正,D8操作手册,D8操作手册::chunk_12;D8操作手册::chunk_13,,D8操作手册.md
ENT_000303,FaultPhenomenon_Starter Motor Overheat,FaultPhenomenon,起动马达因长时间接合导致的过热故障,D8操作手册,D8操作手册::chunk_20,,D8操作手册.md
ENT_000304,FaultPhenomenon_Swimming Platform Collision,FaultPhenomenon,游泳跳台碰撞，跳台与驱动装置接触造成的重大机械损坏,D8操作手册,D8操作手册::chunk_19,,D8操作手册.md
ENT_000305,FaultPhenomenon_System Performance Fault,FaultPhenomenon,因改装或第三方系统导致的系统性能与安全故障,D8操作手册,D8操作手册::chunk_10;D8操作手册::chunk_11;D8操作手册::chunk_8;D8操作手册::chunk_9,,D8操作手册.md
ENT_000306,FaultPhenomenon_Transmission Stress,FaultPhenomenon,传动装置因不当换档承受不必要应力的现象,D8操作手册,D8操作手册::chunk_21,,D8操作手册.md
ENT_000307,FaultPhenomenon_Unintended Vessel Movement,FaultPhenomenon,DPS 使用时船只可能发生的意外移动风险,D8操作手册,D8操作手册::chunk_17,,D8操作手册.md
ENT_000308,FaultPhenomenon_Warranty Void,FaultPhenomenon,因违规操作或改装导致保修索赔被拒绝或失效,D8操作手册,D8操作手册::chunk_10;D8操作手册::chunk_11;D8操作手册::chunk_8;D8操作手册::chunk_9,,D8操作手册.md
ENT_000309,FaultPhenomenon_Water Ingestion,FaultPhenomenon,水通过排气管进入静止发动机导致的故障现象,D8操作手册,D8操作手册::chunk_21,,D8操作手册.md
ENT_000310,Marine Engine System_FaultPhenomenon_Alternator Damage,FaultPhenomenon,交流发电机因不当操作导致的损坏,D8操作手册,D8操作手册::chunk_28,,D8操作手册.md
ENT_000311,Marine Engine System_FaultPhenomenon_Battery Discharge,FaultPhenomenon,电池因漏电或老化导致的电量耗尽,D8操作手册,D8操作手册::chunk_28,,D8操作手册.md
ENT_000312,Marine Engine System_FaultPhenomenon_Depth Signal Loss,FaultPhenomenon,深度探测器信号丢失导致无法显示水深或触发警报的异常现象,D8操作手册,D8操作手册::chunk_29,,D8操作手册.md
ENT_000313,Marine Engine System_FaultPhenomenon_Drive Belt Wear,FaultPhenomenon,传动皮带磨损或破裂，需立即更换,D8操作手册,D8操作手册::chunk_24,,D8操作手册.md
ENT_000314,Marine Engine System_FaultPhenomenon_Electrical Cable Damage,FaultPhenomenon,电气电缆损坏，高压清洗可能导致此故障,D8操作手册,D8操作手册::chunk_24,,D8操作手册.md
ENT_000315,Marine Engine System_FaultPhenomenon_Engine Corrosion,FaultPhenomenon,因冷却剂不当导致发动机内部腐蚀的异常现象,D8操作手册,D8操作手册::chunk_25,,D8操作手册.md
ENT_000316,Marine Engine System_FaultPhenomenon_Engine Overheat,FaultPhenomenon,因冷却不足导致的发动机过热异常,D8操作手册,D8操作手册::chunk_28,,D8操作手册.md
ENT_000317,Marine Engine System_FaultPhenomenon_Engine Unexpected Stop,FaultPhenomenon,因燃油系统问题导致的发动机意外停止,D8操作手册,D8操作手册::chunk_31,,D8操作手册.md
ENT_000318,Marine Engine System_FaultPhenomenon_Fluid Leak,FaultPhenomenon,机油、燃油或冷却剂泄漏现象，起动前必须调查,D8操作手册,D8操作手册::chunk_24,,D8操作手册.md
ENT_000319,Marine Engine System_FaultPhenomenon_Fuel Filter Blockage,FaultPhenomenon,因燃油质量问题导致的过滤器堵塞现象,D8操作手册,D8操作手册::chunk_31,,D8操作手册.md
ENT_000320,Marine Engine System_FaultPhenomenon_Incorrect Oil Level Reading,FaultPhenomenon,因发动机未水平或停机时间不足导致的油位读数错误,D8操作手册,D8操作手册::chunk_25,,D8操作手册.md
ENT_000321,Volvo Penta Engine_Cooling System_Coolant Mixing Damage,FaultPhenomenon,因冷却剂混合不当导致的冷却系统损坏现象,D8维护保养手册,D8维护保养手册::chunk_9,,D8维护保养手册.md
ENT_000322,Volvo Penta Engine_Fault_Alternator Water Ingress,FaultPhenomenon,交流发电机进水故障,D8维护保养手册,D8维护保养手册::chunk_25;D8维护保养手册::chunk_26;D8维护保养手册::chunk_27;D8维护保养手册::chunk_28,,D8维护保养手册.md
ENT_000323,Volvo Penta Engine_Fault_Battery Fire And Explosion Risk,FaultPhenomenon,电池附近明火或火花引发的火灾和爆炸危险,D8维护保养手册,D8维护保养手册::chunk_29;D8维护保养手册::chunk_30,,D8维护保养手册.md
ENT_000324,Volvo Penta Engine_Fault_Battery Freezing,FaultPhenomenon,低温下充电不足的电池冻结破裂现象,D8维护保养手册,D8维护保养手册::chunk_22;D8维护保养手册::chunk_23,,D8维护保养手册.md
ENT_000325,Volvo Penta Engine_Fault_Battery Stray Current And Discharge,FaultPhenomenon,因端子氧化物或连接松动导致的杂散电流及异常放电现象,D8维护保养手册,D8维护保养手册::chunk_29;D8维护保养手册::chunk_30,,D8维护保养手册.md
ENT_000326,Volvo Penta Engine_Fault_Component Malfunction,FaultPhenomenon,因污物导致的组件功能异常或失效现象,D8维护保养手册,D8维护保养手册::chunk_4;D8维护保养手册::chunk_5,,D8维护保养手册.md
ENT_000327,Volvo Penta Engine_Fault_Coolant Leak,FaultPhenomenon,燃油泄漏现象，存在火灾风险；冷却液泄漏现象，需修复后起动；机油泄漏现象，需检查涡轮及油底壳,D8维护保养手册,D8维护保养手册::chunk_10;D8维护保养手册::chunk_11,,D8维护保养手册.md
ENT_000328,Volvo Penta Engine_Fault_Electrical Equipment Damage,FaultPhenomenon,因极性错误导致的电气设备严重损坏现象,D8维护保养手册,D8维护保养手册::chunk_4;D8维护保养手册::chunk_5,,D8维护保养手册.md
ENT_000329,Volvo Penta Engine_Fault_Engine Corrosion And Mold,FaultPhenomenon,存储期间因通风不良导致的霉菌与腐蚀,D8维护保养手册,D8维护保养手册::chunk_22;D8维护保养手册::chunk_23,,D8维护保养手册.md
ENT_000330,Volvo Penta Engine_Fault_Frost Weathering,FaultPhenomenon,残留水导致的冰冻风化现象,D8维护保养手册,D8维护保养手册::chunk_25;D8维护保养手册::chunk_26;D8维护保养手册::chunk_27;D8维护保养手册::chunk_28,,D8维护保养手册.md
ENT_000331,Volvo Penta Engine_Fault_Fuel Pipe Cracking,FaultPhenomenon,燃油高压管开裂导致的泄漏现象,D8维护保养手册,D8维护保养手册::chunk_4;D8维护保养手册::chunk_5,,D8维护保养手册.md
ENT_000332,Volvo Penta Engine_Fault_Fuel System Microbial Growth,FaultPhenomenon,燃油中因 FAME 或水分导致的微生物滋生阻塞,D8维护保养手册,D8维护保养手册::chunk_22;D8维护保养手册::chunk_23,,D8维护保养手册.md
ENT_000333,Volvo Penta Engine_Fault_Wiring Damage,FaultPhenomenon,电线损坏或松动，一般检查项目,D8维护保养手册,D8维护保养手册::chunk_10;D8维护保养手册::chunk_11,,D8维护保养手册.md
