entity_id,name,label,description,doc_id,chunk_id,all_labels,source
ENT_000001,Marine Engine System_Active Corrosion Protection,Component,主动防腐蚀保护系统，显示有关船只安装的信息,D8操作手册,D8操作手册::chunk_13,,D8操作手册.md
ENT_000002,Marine Engine System_Alarm Monitor,Component,针对激活警报发出目视警告的监测组件,D8操作手册,D8操作手册::chunk_12,,D8操作手册.md
ENT_000003,Marine Engine System_Alternator,Component,交流发电机，发动机运行时提供电力并受主开关保护；发动机配套的交流发电组件,D8操作手册,D8操作手册::chunk_1;D8操作手册::chunk_2;D8操作手册::chunk_28;D8操作手册::chunk_3;D8操作手册::chunk_4,,D8操作手册.md
ENT_000004,Marine Engine System_Auxiliary Stop Device,Component,安装在发动机背部的紧急停机硬件装置,D8操作手册,D8操作手册::chunk_22,,D8操作手册.md
ENT_000005,Marine Engine System_Battery,Component,发动机启动及供电核心模块，存在氢气爆炸风险；为发动机电气系统供电的独立电池组,D8操作手册,D8操作手册::chunk_0;D8操作手册::chunk_28,Component;Equipment,D8操作手册.md
ENT_000006,Marine Engine System_Battery Management Display,Component,电池管理系统的本地显示与设置界面模块,D8操作手册,D8操作手册::chunk_18,,D8操作手册.md
ENT_000007,Marine Engine System_Battery Management Unit,Component,执行电池管理逻辑与断路器控制的核心单元,D8操作手册,D8操作手册::chunk_18,,D8操作手册.md
ENT_000008,Marine Engine System_Battery Sensor,Component,电池传感器，用于监测电池状态并提供数据给电池视图,D8操作手册,D8操作手册::chunk_14,,D8操作手册.md
ENT_000009,Marine Engine System_Compass Unit,Component,自动操舵仪内的核心罗盘传感器模块，提供航向数据,D8操作手册,D8操作手册::chunk_15,,D8操作手册.md
ENT_000010,Marine Engine System_Component_Engine Type Plate,Component,发动机上的信息铭牌组件,D8操作手册,D8操作手册::chunk_31,,D8操作手册.md
ENT_000011,Marine Engine System_Component_Fuel Heater,Component,低温环境下使用高 FAME 燃料所需的加热模块,D8操作手册,D8操作手册::chunk_31,,D8操作手册.md
ENT_000012,Marine Engine System_Control Software,Component,控制发动机功能并可进行更新维护的软件模块,D8操作手册,D8操作手册::chunk_7,,D8操作手册.md
ENT_000013,Marine Engine System_Coolant Temperature Gauge,Component,显示发动机冷却剂温度的仪表组件,D8操作手册,D8操作手册::chunk_12,,D8操作手册.md
ENT_000014,Marine Engine System_Cooling System,Component,发动机冷却循环系统，包含海水龙头和安全阀等关键部件；发动机冷却系统，涉及冷却剂混合与循环；负责发动机温度控制与冷却液循环的整体系统；船舶发动机冷却系统整体,D8操作手册,D8操作手册::chunk_1;D8操作手册::chunk_10;D8操作手册::chunk_11;D8操作手册::chunk_2;D8操作手册::chunk_25;D8操作手册::chunk_3;D8操作手册::chunk_30;D8操作手册::chunk_4;D8操作手册::chunk_8;D8操作手册::chunk_9,Component;System,D8操作手册.md
ENT_000015,Marine Engine System_Cruise Control,Component,巡航控制模块，用于锁定和微调发动机转速,D8操作手册,D8操作手册::chunk_14,,D8操作手册.md
ENT_000016,Marine Engine System_Docking Mode,Component,操纵杆内的停靠模式软件组件，限制发动机转数并控制船方向；操纵杆系统内的入坞模式功能模块,D8操作手册,D8操作手册::chunk_15;D8操作手册::chunk_30,,D8操作手册.md
ENT_000017,Marine Engine System_Drive Belt,Component,发动机传动皮带，配有自动张紧装置，需定期检查状况,D8操作手册,D8操作手册::chunk_24,,D8操作手册.md
ENT_000018,Marine Engine System_Drive Belt Guard,Component,覆盖传动皮带的安全防护罩,D8操作手册,D8操作手册::chunk_25,,D8操作手册.md
ENT_000019,Marine Engine System_Drive Device,Component,驱动装置，受动力升降系统控制以调整船舶纵倾,D8操作手册,D8操作手册::chunk_14,,D8操作手册.md
ENT_000020,Marine Engine System_Easy Connect,Component,蓝牙连接模块，用于船只与移动设备数据交互的核心组件,D8操作手册,D8操作手册::chunk_19,,D8操作手册.md
ENT_000021,Marine Engine System_Echo Sounder,Component,回声探测器，用于设置深度警报和显示船下深度；用于探测水深并提供深度警报的核心传感器模块,D8操作手册,D8操作手册::chunk_13;D8操作手册::chunk_29,,D8操作手册.md
ENT_000022,Marine Engine System_Electrical System,Component,发动机电气控制子系统，需使用原厂备件以防火灾；电气系统，包含电池传感器等电气组件,D8操作手册,D8操作手册::chunk_0;D8操作手册::chunk_14,,D8操作手册.md
ENT_000023,Marine Engine System_Engine Control Module,Component,发动机核心控制单元，负责监测和控制发动机运行参数；发动机控制模块计算机，记录发动机数据与位置信息；负责监控发动机参数并执行安全逻辑的核心控制模块,D8操作手册,D8操作手册::chunk_1;D8操作手册::chunk_10;D8操作手册::chunk_11;D8操作手册::chunk_2;D8操作手册::chunk_21;D8操作手册::chunk_3;D8操作手册::chunk_4;D8操作手册::chunk_8;D8操作手册::chunk_9,,D8操作手册.md
ENT_000024,Marine Engine System_Engine Heater,Component,发动机加热器，低温环境下减少冷启动烟雾的辅助组件,D8操作手册,D8操作手册::chunk_19,,D8操作手册.md
ENT_000025,Marine Engine System_Exhaust System,Component,发动机排气及涡轮增压组件，包含高温表面风险,D8操作手册,D8操作手册::chunk_0,,D8操作手册.md
ENT_000026,Marine Engine System_Fresh Water Level Sensor,Component,显示淡水箱中淡水水位的传感器组件,D8操作手册,D8操作手册::chunk_12,,D8操作手册.md
ENT_000027,Marine Engine System_Fuel Filter,Component,燃油系统中的核心过滤组件，用于拦截杂质,D8操作手册,D8操作手册::chunk_25,,D8操作手册.md
ENT_000028,Marine Engine System_Fuel Level Gauge,Component,显示剩余燃油液位的仪表组件,D8操作手册,D8操作手册::chunk_12,,D8操作手册.md
ENT_000029,Marine Engine System_Fuel Level Sensor,Component,安装在燃油箱内用于检测燃油液位的传感组件,D8操作手册,D8操作手册::chunk_29,,D8操作手册.md
ENT_000030,Marine Engine System_Fuel Pressure Gauge,Component,安装在过滤器上用于指示压降的压力表,D8操作手册,D8操作手册::chunk_25,,D8操作手册.md
ENT_000031,Marine Engine System_Fuel System,Component,发动机燃油供给子系统，涉及易燃液体泄漏风险；发动机燃油供给系统，包含喷射泵与喷油器等核心模块；负责燃油供给、过滤与喷射的整体系统,D8操作手册,D8操作手册::chunk_0;D8操作手册::chunk_10;D8操作手册::chunk_11;D8操作手册::chunk_25;D8操作手册::chunk_8;D8操作手册::chunk_9,Component;System,D8操作手册.md
ENT_000032,Marine Engine System_GPS Receiver,Component,为动态定位系统提供位置信号的 GPS 接收模块,D8操作手册,D8操作手册::chunk_17,,D8操作手册.md
ENT_000033,Marine Engine System_Impeller,Component,海水泵内的核心旋转叶轮部件,D8操作手册,D8操作手册::chunk_28,,D8操作手册.md
ENT_000034,Marine Engine System_Injection Pump,Component,燃油喷射泵，燃油系统核心高压供给模块,D8操作手册,D8操作手册::chunk_10;D8操作手册::chunk_11;D8操作手册::chunk_8;D8操作手册::chunk_9,,D8操作手册.md
ENT_000035,Marine Engine System_Injector,Component,喷油器，燃油系统核心喷射执行部件,D8操作手册,D8操作手册::chunk_10;D8操作手册::chunk_11;D8操作手册::chunk_8;D8操作手册::chunk_9,,D8操作手册.md
ENT_000036,Marine Engine System_Joystick Driving Module,Component,操纵杆驾驶控制逻辑模块，集成转向、节气门和换档控制,D8操作手册,D8操作手册::chunk_16,,D8操作手册.md
ENT_000037,Marine Engine System_Joystick Steering Module,Component,操纵杆转向控制逻辑模块，处理航向调整和转向指令,D8操作手册,D8操作手册::chunk_16,,D8操作手册.md
ENT_000038,Marine Engine System_Low Speed Module,Component,低速功能控制模块，用于液压传动装置发动机的转速与螺旋桨转速解耦,D8操作手册,D8操作手册::chunk_15,,D8操作手册.md
ENT_000039,Marine Engine System_Lubrication System,Component,发动机润滑系统，涉及热油压力管理和加油口盖操作；发动机润滑系统，涉及机油粘度与油位监控；负责发动机机油循环与润滑的整体系统；船舶发动机润滑系统整体,D8操作手册,D8操作手册::chunk_1;D8操作手册::chunk_10;D8操作手册::chunk_11;D8操作手册::chunk_2;D8操作手册::chunk_25;D8操作手册::chunk_3;D8操作手册::chunk_30;D8操作手册::chunk_4;D8操作手册::chunk_8;D8操作手册::chunk_9,Component;System,D8操作手册.md
ENT_000040,Marine Engine System_Oil Level Sensor,Component,监测润滑系统机油液位的电子传感器,D8操作手册,D8操作手册::chunk_25,,D8操作手册.md
ENT_000041,Marine Engine System_Oil Pressure Gauge,Component,显示发动机机油压力的仪表组件,D8操作手册,D8操作手册::chunk_12,,D8操作手册.md
ENT_000042,Marine Engine System_Power Take-Off,Component,功率输出端模块，用于将发动机动力从推进装置断开的功能单元,D8操作手册,D8操作手册::chunk_19,,D8操作手册.md
ENT_000043,Marine Engine System_Power Trim Assist,Component,动力升降辅助装置，根据发动机转速自动调整纵倾角,D8操作手册,D8操作手册::chunk_14,,D8操作手册.md
ENT_000044,Marine Engine System_Propeller Shaft Brake,Component,推进轴制动器，用于发动机停止时锁止螺旋桨轴的核心模块,D8操作手册,D8操作手册::chunk_19,,D8操作手册.md
ENT_000045,Marine Engine System_Rudder Position Indicator,Component,显示舵位置的仪表组件,D8操作手册,D8操作手册::chunk_12,,D8操作手册.md
ENT_000046,Marine Engine System_Safety Lanyard,Component,用于在船长失去控制时停止发动机的安全装置,D8操作手册,D8操作手册::chunk_7,,D8操作手册.md
ENT_000047,Marine Engine System_Starter Motor,Component,发动机起动马达，负责驱动发动机曲轴旋转,D8操作手册,D8操作手册::chunk_20,,D8操作手册.md
ENT_000048,Marine Engine System_Swimming Platform Interface,Component,游泳跳台接口模块，防止跳台与驱动装置碰撞的控制单元,D8操作手册,D8操作手册::chunk_19,,D8操作手册.md
ENT_000049,Marine Engine System_Tachometer,Component,显示发动机转速和发动机时数的仪表组件,D8操作手册,D8操作手册::chunk_12,,D8操作手册.md
ENT_000050,Marine Engine System_Trip Computer,Component,集成在显示器内计算燃油经济性和行程数据的逻辑模块；行程计算机，显示船只的行程计算机数据和燃油经济性,D8操作手册,D8操作手册::chunk_12;D8操作手册::chunk_13,,D8操作手册.md
ENT_000051,Marine Engine System_Turbocharger,Component,涡轮增压器组件，包含高速旋转的压缩机涡轮,D8操作手册,D8操作手册::chunk_1;D8操作手册::chunk_2;D8操作手册::chunk_3;D8操作手册::chunk_4,,D8操作手册.md
ENT_000052,Marine Engine System_Voltmeter,Component,显示交流发电机充电电流和电池电压的仪表组件,D8操作手册,D8操作手册::chunk_12,,D8操作手册.md
ENT_000053,Marine Engine System_Warning Management Program,Component,存储故障消息并建议校正措施的软件模块；警告管理程序，存储故障并显示受影响的传动系统和建议操作；警告管理程序，存储故障信息并建议操作,D8操作手册,D8操作手册::chunk_12;D8操作手册::chunk_13;D8操作手册::chunk_14,,D8操作手册.md
ENT_000054,Marine Engine System_Water Separator,Component,燃油系统中用于分离水分的独立模块,D8操作手册,D8操作手册::chunk_25,,D8操作手册.md
ENT_000055,Volvo Penta Engine_Cooling System_Charge Air Cooler,Component,增压空气冷却器，需检查冷却液泄漏,D8维护保养手册,D8维护保养手册::chunk_10;D8维护保养手册::chunk_11,,D8维护保养手册.md
ENT_000056,Volvo Penta Engine_Cooling System_Coolant Pump,Component,冷却系统核心模块，负责发动机内部冷却液循环,D8维护保养手册,D8维护保养手册::chunk_4;D8维护保养手册::chunk_5,,D8维护保养手册.md
ENT_000057,Volvo Penta Engine_Cooling System_Cooling Water Inlet,Component,冷却水入口组件，包含旋塞和外部格栅,D8维护保养手册,D8维护保养手册::chunk_14,,D8维护保养手册.md
ENT_000058,Volvo Penta Engine_Cooling System_Expansion Tank,Component,冷却液膨胀箱，需检查泄漏,D8维护保养手册,D8维护保养手册::chunk_10;D8维护保养手册::chunk_11,,D8维护保养手册.md
ENT_000059,Volvo Penta Engine_Cooling System_Heat Exchanger,Component,热交换器冷却组件,D8维护保养手册,D8维护保养手册::chunk_25;D8维护保养手册::chunk_26;D8维护保养手册::chunk_27;D8维护保养手册::chunk_28,,D8维护保养手册.md
ENT_000060,Volvo Penta Engine_Cooling System_Sacrificial Anode,Component,位于热交换器和增压空气冷却器上的牺牲阳极,D8维护保养手册,D8维护保养手册::chunk_14,,D8维护保养手册.md
ENT_000061,Volvo Penta Engine_Cooling System_Sea Water Pump,Component,冷却系统核心模块，负责海水循环冷却,D8维护保养手册,D8维护保养手册::chunk_4;D8维护保养手册::chunk_5,,D8维护保养手册.md
ENT_000062,Volvo Penta Engine_Cooling System_Seawater Pump Impeller,Component,海水泵核心叶轮部件，长期存储时需取出以防变形,D8维护保养手册,D8维护保养手册::chunk_29;D8维护保养手册::chunk_30,,D8维护保养手册.md
ENT_000063,Volvo Penta Engine_Electrical System_Alternator,Component,发动机电气系统内的交流发电机部件；交流发电机核心发电部件,D8维护保养手册,D8维护保养手册::chunk_0;D8维护保养手册::chunk_1;D8维护保养手册::chunk_2;D8维护保养手册::chunk_25;D8维护保养手册::chunk_26;D8维护保养手册::chunk_27;D8维护保养手册::chunk_28;D8维护保养手册::chunk_3,,D8维护保养手册.md
ENT_000064,Volvo Penta Engine_Electrical System_Battery,Component,电气系统核心储能部件，存在爆炸与腐蚀风险；船舶电气系统核心储能设备，需定期维护以防冻结和腐蚀,D8维护保养手册,D8维护保养手册::chunk_29;D8维护保养手册::chunk_30;D8维护保养手册::chunk_4;D8维护保养手册::chunk_5,,D8维护保养手册.md
ENT_000065,Volvo Penta Engine_Electrical System_Battery Cable,Component,连接电池正负极的高电流电缆，拆装需遵循严格顺序,D8维护保养手册,D8维护保养手册::chunk_29;D8维护保养手册::chunk_30,,D8维护保养手册.md
ENT_000066,Volvo Penta Engine_Electrical System_Battery Management System,Component,发动机电气系统内的电池管理模块,D8维护保养手册,D8维护保养手册::chunk_0;D8维护保养手册::chunk_1;D8维护保养手册::chunk_2;D8维护保养手册::chunk_3,,D8维护保养手册.md
ENT_000067,Volvo Penta Engine_Electrical System_Engine Control Module,Component,发动机电气系统内的核心控制模块,D8维护保养手册,D8维护保养手册::chunk_0;D8维护保养手册::chunk_1;D8维护保养手册::chunk_2;D8维护保养手册::chunk_3,,D8维护保养手册.md
ENT_000068,Volvo Penta Engine_Electrical System_Wiring Harness,Component,发动机线束及电缆组件,D8维护保养手册,D8维护保养手册::chunk_25;D8维护保养手册::chunk_26;D8维护保养手册::chunk_27;D8维护保养手册::chunk_28,,D8维护保养手册.md
ENT_000069,Volvo Penta Engine_Exhaust System_AdBlue Tank,Component,用于储存 AdBlue/DEF 溶液的排气系统处理罐，存储前需清空清洁,D8维护保养手册,D8维护保养手册::chunk_24,,D8维护保养手册.md
ENT_000070,Volvo Penta Engine_Exhaust System_Diesel Particulate Filter,Component,排气系统核心模块，用于过滤柴油颗粒,D8维护保养手册,D8维护保养手册::chunk_4;D8维护保养手册::chunk_5,,D8维护保养手册.md
ENT_000071,Volvo Penta Engine_Exhaust System_Silencer,Component,排气系统消音器，可能因机油过多导致堵塞,D8维护保养手册,D8维护保养手册::chunk_12,,D8维护保养手册.md
ENT_000072,Volvo Penta Engine_Fuel System_Common Rail,Component,燃油共轨系统核心部件，需检查泄漏,D8维护保养手册,D8维护保养手册::chunk_10;D8维护保养手册::chunk_11,,D8维护保养手册.md
ENT_000073,Volvo Penta Engine_Fuel System_Fuel Filter,Component,燃油过滤器，一般检查项目之一,D8维护保养手册,D8维护保养手册::chunk_10;D8维护保养手册::chunk_11,,D8维护保养手册.md
ENT_000074,Volvo Penta Engine_Fuel System_Fuel Injector,Component,喷油器组件，连接处需检查泄漏,D8维护保养手册,D8维护保养手册::chunk_10;D8维护保养手册::chunk_11,,D8维护保养手册.md
ENT_000075,Volvo Penta Engine_Fuel System_Fuel Pump,Component,燃油系统核心模块，负责燃油供给加压,D8维护保养手册,D8维护保养手册::chunk_4;D8维护保养手册::chunk_5,,D8维护保养手册.md
ENT_000076,Volvo Penta Engine_Fuel System_Fuel Tank,Component,存储燃油的核心容器，需防止冷凝和氧化,D8维护保养手册,D8维护保养手册::chunk_22;D8维护保养手册::chunk_23,,D8维护保养手册.md
ENT_000077,Volvo Penta Engine_Fuel System_High Pressure Fuel Pipe,Component,燃油系统高压管路组件，严禁弯曲或拉直,D8维护保养手册,D8维护保养手册::chunk_4;D8维护保养手册::chunk_5,,D8维护保养手册.md
ENT_000078,Volvo Penta Engine_Intake System_Air Filter,Component,发动机进气系统内的空气过滤器组件,D8维护保养手册,D8维护保养手册::chunk_0;D8维护保养手册::chunk_1;D8维护保养手册::chunk_2;D8维护保养手册::chunk_3,,D8维护保养手册.md
ENT_000079,Volvo Penta Engine_Lubrication System_Dipstick,Component,润滑系统油尺，用于测量发动机机油液位,D8维护保养手册,D8维护保养手册::chunk_12,,D8维护保养手册.md
ENT_000080,Volvo Penta Engine_Lubrication System_Oil Filter,Component,润滑系统机油过滤器，用于过滤机油杂质,D8维护保养手册,D8维护保养手册::chunk_12,,D8维护保养手册.md
ENT_000081,Volvo Penta Engine_Mechanical System_Air Compressor,Component,空气压缩机，需检查油位,D8维护保养手册,D8维护保养手册::chunk_10;D8维护保养手册::chunk_11,,D8维护保养手册.md
ENT_000082,Volvo Penta Engine_Mechanical System_Belt Tensioner,Component,皮带张紧器机械组件,D8维护保养手册,D8维护保养手册::chunk_25;D8维护保养手册::chunk_26;D8维护保养手册::chunk_27;D8维护保养手册::chunk_28,,D8维护保养手册.md
ENT_000083,Volvo Penta Engine_Mechanical System_Crankshaft,Component,机械系统曲轴，发动机核心旋转部件,D8维护保养手册,D8维护保养手册::chunk_12,,D8维护保养手册.md
ENT_000084,Volvo Penta Engine_Mechanical System_Cylinder Head,Component,发动机顶部核心组件，包含气门机构及燃烧室顶部结构,D8维护保养手册,D8维护保养手册::chunk_6,,D8维护保养手册.md
ENT_000085,Volvo Penta Engine_Mechanical System_Cylinder Head Overhaul Kit,Component,专用于缸盖维修的备件封装套件，包含衬垫等消耗件,D8维护保养手册,D8维护保养手册::chunk_6,,D8维护保养手册.md
ENT_000086,Volvo Penta Engine_Mechanical System_Cylinder Liner,Component,发动机气缸内壁套筒，部分设计不可更换需整体评估,D8维护保养手册,D8维护保养手册::chunk_6,,D8维护保养手册.md
ENT_000087,Volvo Penta Engine_Mechanical System_Drive Belt,Component,发动机附件传动带，存储后需检查状况,D8维护保养手册,D8维护保养手册::chunk_22;D8维护保养手册::chunk_23,,D8维护保养手册.md
ENT_000088,Volvo Penta Engine_Mechanical System_Engine Block,Component,发动机主体骨架，包含气缸体及曲轴箱结构,D8维护保养手册,D8维护保养手册::chunk_6,,D8维护保养手册.md
ENT_000089,Volvo Penta Engine_Mechanical System_Idler,Component,惰轮机械组件,D8维护保养手册,D8维护保养手册::chunk_25;D8维护保养手册::chunk_26;D8维护保养手册::chunk_27;D8维护保养手册::chunk_28,,D8维护保养手册.md
ENT_000090,Volvo Penta Engine_Mechanical System_Oil Pan,Component,油底壳，需检查机油泄漏,D8维护保养手册,D8维护保养手册::chunk_10;D8维护保养手册::chunk_11,,D8维护保养手册.md
ENT_000091,Volvo Penta Engine_Mechanical System_Overhaul Kit,Component,发动机全面大修所需的备件封装套件,D8维护保养手册,D8维护保养手册::chunk_6,,D8维护保养手册.md
ENT_000092,Volvo Penta Engine_Mechanical System_Piston,Component,发动机气缸内核心运动部件，承受燃烧压力并传递动力,D8维护保养手册,D8维护保养手册::chunk_6,,D8维护保养手册.md
ENT_000093,Volvo Penta Engine_Mechanical System_Rubber Hose,Component,发动机各类橡胶软管，需检查老化与密封性,D8维护保养手册,D8维护保养手册::chunk_22;D8维护保养手册::chunk_23,,D8维护保养手册.md
ENT_000094,Volvo Penta Engine_Mechanical System_Sound Insulation Material,Component,发动机舱吸声隔音材料,D8维护保养手册,D8维护保养手册::chunk_25;D8维护保养手册::chunk_26;D8维护保养手册::chunk_27;D8维护保养手册::chunk_28,,D8维护保养手册.md
ENT_000095,Volvo Penta Engine_Mechanical System_Starter Motor,Component,发动机起动系统的核心执行部件，负责驱动发动机旋转,D8维护保养手册,D8维护保养手册::chunk_6,,D8维护保养手册.md
ENT_000096,Volvo Penta Engine_Mechanical System_Turbocharger,Component,发动机机械系统内的涡轮增压器部件,D8维护保养手册,D8维护保养手册::chunk_0;D8维护保养手册::chunk_1;D8维护保养手册::chunk_2;D8维护保养手册::chunk_3,,D8维护保养手册.md
ENT_000097,Volvo Penta Engine_Steering System_Dipstick,Component,电动操舵器专用的油位检查量油尺；用于检查油位及作为换油抽油孔位的油尺组件,D8维护保养手册,D8维护保养手册::chunk_17;D8维护保养手册::chunk_18;D8维护保养手册::chunk_19;D8维护保养手册::chunk_20;D8维护保养手册::chunk_21,,D8维护保养手册.md
ENT_000098,Volvo Penta Engine_Steering System_Electric Steering Unit,Component,电动操舵器，用于船舶转向控制的核心模块；电动操舵器核心控制部件，需定期更换机油并检查机械连杆,D8维护保养手册,D8维护保养手册::chunk_21;D8维护保养手册::chunk_9,,D8维护保养手册.md
ENT_000099,Volvo Penta Engine_Transmission System_Aquamatic Unit,Component,沃尔沃遍达舷内外机传动装置的具体型号组件,D8维护保养手册,D8维护保养手册::chunk_7;D8维护保养手册::chunk_8,,D8维护保养手册.md
ENT_000100,Volvo Penta Engine_Transmission System_Clamping Ring,Component,用于固定密封的夹紧环组件,D8维护保养手册,D8维护保养手册::chunk_15,,D8维护保养手册.md
ENT_000101,Volvo Penta Engine_Transmission System_Control Display,Component,用于显示校准状态和系统信息的控制显示单元,D8维护保养手册,D8维护保养手册::chunk_16,,D8维护保养手册.md
ENT_000102,Volvo Penta Engine_Transmission System_Dipstick,Component,变速箱系统专用的油位量油尺,D8维护保养手册,D8维护保养手册::chunk_15,,D8维护保养手册.md
ENT_000103,Volvo Penta Engine_Transmission System_Drive Unit Output Shaft,Component,驱动装置或换向器的输出轴，存储期间需手动旋转防锈,D8维护保养手册,D8维护保养手册::chunk_29;D8维护保养手册::chunk_30,,D8维护保养手册.md
ENT_000104,Volvo Penta Engine_Transmission System_Exhaust Gasket,Component,排气板处的可更换密封衬垫,D8维护保养手册,D8维护保养手册::chunk_15,,D8维护保养手册.md
ENT_000105,Volvo Penta Engine_Transmission System_Exhaust Plate,Component,IPS 装置上的排气板组件，含白色塑料部分,D8维护保养手册,D8维护保养手册::chunk_15,,D8维护保养手册.md
ENT_000106,Volvo Penta Engine_Transmission System_IPS Drive Unit,Component,沃尔沃遍达 IPS 驱动装置的核心传动组件,D8维护保养手册,D8维护保养手册::chunk_7;D8维护保养手册::chunk_8,,D8维护保养手册.md
ENT_000107,Volvo Penta Engine_Transmission System_Lower Gear Kit,Component,传动装置下部齿轮的维修更换套件模块,D8维护保养手册,D8维护保养手册::chunk_7;D8维护保养手册::chunk_8,,D8维护保养手册.md
ENT_000108,Volvo Penta Engine_Transmission System_Oil Cooler,Component,变速箱液压润滑系统中的机油冷却模块,D8维护保养手册,D8维护保养手册::chunk_17;D8维护保养手册::chunk_18;D8维护保养手册::chunk_19;D8维护保养手册::chunk_20,,D8维护保养手册.md
ENT_000109,Volvo Penta Engine_Transmission System_Oil Filter,Component,变速箱系统内的机油过滤组件,D8维护保养手册,D8维护保养手册::chunk_15,,D8维护保养手册.md
ENT_000110,Volvo Penta Engine_Transmission System_Oil Quality Sensor,Component,IPS 装置用于监测油液质量的传感器模块,D8维护保养手册,D8维护保养手册::chunk_15,,D8维护保养手册.md
